,Unnamed: 0,Nombre,Página Web,Email,Entidad,Municipio,Enlace SIC,Descripción
398,398,Casa de Cultura Diego Rivera,https://es-la.facebook.com/pg/ccdiegorivera/about/?ref=page_internal,diegoriveratlahuac@hotmail.com,Ciudad de México,Tláhuac,http://sic.gob.mx/ficha.php?table=centro_cultural&table_id=972,"El inmueble fue construido exprofeso para albergar la Casa de Cultura Diego Rivera.

Superficie de construcción: 600 m2

Tipo de público al que está dirigida la casa de cultura: General

Asistencia promedio mensual de visitantes: de 250 a 300 personas
Asistencia total de visitantes en el año 2013: 2,800 personas"
399,399,Centro Cultural Ing. Juan Manuel Martínez G.,,cencultjuanmanuelmtz@hotmail.com,Ciudad de México,Tláhuac,http://sic.gob.mx/ficha.php?table=centro_cultural&table_id=2772,"Asistencia promedio mensual de visitantes: 200 personas
Asistencia total de visitantes en el año 2013: 500 personas.

Superficie de construcción: 200 m2

Tipo de público al que está dirigido el centro cultural: General"
400,400,"Casa Frissac, Centro Cultural",https://culturatlalpan.wixsite.com/cultura/project-2,mando_55_mx@yahoo.com.mx,Ciudad de México,Tlalpan,http://sic.gob.mx/ficha.php?table=centro_cultural&table_id=2096,"Construida a finales del siglo XIX por el hacendado Don Jesús Pliego Frissac, quien fungió como presidente del Ayuntamiento local en 1900. Posteriormente perteneció a la familia del ex presidente Adolfo López Mateos y funcionó como la Escuela Lancaster del Proyecto Bicultural Británico-Mexicano. Este inmueble fue incorporado al Decreto de Zona de Monumentos el 5 de diciembre de 1986, y en el 2000 recibió el nombre de Instituto Javier Barros Sierra, toda vez que fue adquirido, rehabilitado e inaugurado por el Gobierno Delegacional."
401,401,Centro Cultural Ollin Yoliztli (CCOY),http://www.cultura.df.gob.mx/index.php/u-ccoy/,ollinyoliztlidifusion@df.gob.mx; direccionccoy@df.gob.mx; pachecofidencio@gmail.com,Ciudad de México,Tlalpan,http://sic.gob.mx/ficha.php?table=centro_cultural&table_id=963,"El Centro Cultural Ollin Yoliztli (CCOY) es una institución de la Secretaría de Cultura de la Ciudad de México dedicada a la difusión del arte y la cultura, así como al estímulo de la educación artística en los campos de la música y la danza. Ubicado en el sur de la ciudad .
Con seis escuelas de educación profesional en música y danza, su programa académico ofrece desde cursos y talleres de iniciación artística hasta estudios de nivel superior, como la licenciatura en Música. Coordina además el Programa de Orquestas Juveniles y Coros de la Ciudad de México, que está integrado por doce orquestas y nueve coros en distintas delegaciones de la Ciudad de México. Cuenta con una planta docente profesional que atiende, tanto en su sede principal como en otros recintos, a más de 2 200 niños, jóvenes y adultos."
402,402,Centro Cultural Ignacio Ramírez ISSSTE,,svaltoartesescenicas@gmail.com,Ciudad de México,Tlalpan,http://sic.gob.mx/ficha.php?table=centro_cultural&table_id=2466,"Este pabellón fue construido con el patrocinio del Sr. Carleston F. Boyle, antes Instituto Mexicano de Rehabilitación en Noviembre de 1963.

Superficie de construcción: 542.77 m2"
403,403,Casa de la Cultura de Tlalpan,https://www.tlalpan.cdmx.gob.mx/culturaengrande_,mcuencat@tlalpan.cdmx.gob.mx,Ciudad de México,Tlalpan,http://sic.gob.mx/ficha.php?table=centro_cultural&table_id=967,"El inmueble fue adaptado para alberga la Casa de la Cultura de Tlalpan.

La fachada fue construida a principios del siglo XX y diseñada en 1907 por el Ing. Alberto J. Pani, perteneció a la antigua Casa de las Bombas de la colonia Condesa, anteriormente ubicada en las calles Juanacatlán y Tacubaya, misma qué, dejó de funcionar en 1940. Se encuentra construida en piedra de chiluca labrada, característica de la época. El diseño arquitectónico de la fachada, es una media bóveda cóncava exterior, con ventanales de ambos lados. Está decorada con motivos acuáticos, como serpientes, caracoles, tortugas y y tritones. Al centro de la bóveda se localiza una estatua de Neptuno. En 1975 se retiró pieza por pieza y fueron trasladadas al Bosque de Tlalpan, donde permanecieron por largo tiempo en la parte alta del Bosque. Fue hasta 1986, que se colocó la primera piedra de lo que sería esta importante Casa de la Cultura. El proyecto estuvo hecho por el arquitecto Pedro Ramírez Vázquez, quien diseñó el edificio, mezclando el estilo modernista con el neoclásico de principios del siglo XX. La fachada del edificio original fue construida con bloques de piedra natural y se concluyó su construcción en 1988.
El edificio cuenta con modernas instalaciones en su interior, y está en perfecto funcionamiento. La galería y el foro tienen jerarquía ante el resto del interior, por lo que se hace una vista forzosa de la sala, si se quiere llegar a los talleres en los que se imparten una amplia gama de actividades artísticas como música, literatura y danza. Este recinto es sede de la Orquesta Juvenil de Tlalpan, dirigida por el Mtro. Rodrigo Ramos Elorduy, e integrada por 30 talentosos músicos con amplia experiencia ofreciendo conciertos.
Tipo de público al que está dirigida la casa de cultura: General"
404,404,Casa del Virrey de Mendoza,,,Ciudad de México,Tlalpan,http://sic.gob.mx/ficha.php?table=centro_cultural&table_id=2890,"Espacio histórico-cultural que cuenta con un huerto con plantas endémicas y típicas que da una idea de lo que fue Tlalpan en el siglo XVIII y una construcción espléndida. Fue residencia de descanso del virrey Antonio de Mendoza, la versión que se ha transmitido de generación en generación cuenta que ahí se erigía un palacio donde pernoctaba ese personaje cuando visitaba el lugar por las fiestas de San Agustín de las Cuevas. Se abrió al público en mayo de 2012."
405,405,Centro Cultural y Social Hidalguense,http://www.centrohidalguense.com.mx,direccion@centrohidalguense.com.mx; cultura@centrohidalguense.com.mx,Ciudad de México,Tlalpan,http://sic.gob.mx/ficha.php?table=centro_cultural&table_id=2150,"Es una institución privada, cuya principal finalidad es ser un foro de encuentro cultural, donde se manifieste el arte en sus diferentes expresiones, impulsando el trabajo de los artistas nacionales y en particular de los Hidalguenses, a través de exposiciones, presentaciones de obras literarias, seminarios y conferencias. Dando a conocer, la gran riqueza cultural de nuestro pais a través de su folklore, representado en sus danzas, música, artesanía y gastronomía."
406,406,Centro de Artes y Oficios Tiempo Nuevo,http://www.tlalpan.cdmx.gob.mx/centros/centro-de-artes-y-oficios-cao-tiempo-nuevo/,comunicacioncaotlalpan@gmail.com,Ciudad de México,Tlalpan,http://sic.gob.mx/ficha.php?table=centro_cultural&table_id=2613,"Históricamente el espacio es un lugar ganado por la comunidad, quien evito que el gobierno instalara una planta de tratamiento de residuos sólidos (basura) y el inmueble que ya estaba construido se ha ido adaptando para servicios a favor de la población. Primero como un Deportivo y en el año 2006 como Centro de Artes y Oficios, adscrito a la Dirección General de Cultura en la Alcaldía Tlalpan, el inmueble fue adaptado para albergar Centro de Artes y Oficios Tiempo Nuevo"
407,407,Centro de Artes y Oficios (CAO) Xochipilli (Cerrado temporalmente),,alisosnaya@gmail.com,Ciudad de México,Tlalpan,http://sic.gob.mx/ficha.php?table=centro_cultural&table_id=3049,"El CAO Xochipilli, es el segundo de cinco centros de este tipo que la Delegación Tlalpan abrirá en colonias de alta marginación como Cultura Maya, Mesa los Hornos y el pueblo de San Miguel Xicalco, con los que se busca ofrecer a las comunidades diversas opciones de desarrollo social, artístico y cultural."
408,408,Casa de Cultura de la Universidad Autónoma del Estado de México en Tlalpan,http://cdmxtravel.com/es/lugares/casa-de-cultura-de-la-uaemex-en-tlalpan.html,,Ciudad de México,Tlalpan,http://sic.gob.mx/ficha.php?table=centro_cultural&table_id=987,"Ubicada en la también conocida como Casa de las Piedras Mireya. Inmueble rescatado para ser entregado a la Universidad Autónoma del Estado de México. Abrió al público como Casa de Cultura en marzo de 1986. En este domicilio se fundó, el 3 de marzo de 1828, el Instituto Literario del Estado de México, que más tarde, ya ubicado en la ciudad de Toluca, adquirió el nombre de Instituto Científico y Literario para finalmente transformarse en la Universidad Autónoma del Estado de México."
409,409,Casa de Cultura Luis Spota,,,Ciudad de México,Xochimilco,http://sic.gob.mx/ficha.php?table=centro_cultural&table_id=1515,15 de junio de 1988
410,410,Casa del Arte Xochimilco,https://www.facebook.com/pages/Casa-Del-Arte-Xochimilco/531418890286513?ref=ts&fref=ts,casadelarte_xochimilco@hotmail.com,Ciudad de México,Xochimilco,http://sic.gob.mx/ficha.php?table=centro_cultural&table_id=962,"El espacio cultural es un edificio antiguo que data del siglo XVI, se toma el espacio para formar parte de una escuela primaria y en 1984 el INAH lo apertura como casa del cultura, considerándolo como edificio histórico.

Superficie de construcción 1,500 m2

Tipo de público al que está dirigido el espacio cultural: General

Asistencia promedio mensual de visitantes: 1,000 a 1,500 personas
Asistencia total de visitantes en el año 2012: 10,000 personas"
411,411,Casa de Cultura Santa Cecilia Tepetlapa,,,Ciudad de México,Xochimilco,http://sic.gob.mx/ficha.php?table=centro_cultural&table_id=1543,
412,412,Foro Cultural Quetzalcóatl,https://www.facebook.com/pages/Foro-Cultural-Quetzalcoatl/1450692555172717,,Ciudad de México,Xochimilco,http://sic.gob.mx/ficha.php?table=centro_cultural&table_id=796,"Se encuentra dentro de las instalaciones de las oficinas de la Delegación Xochimilco. Cuenta con salas dedicadas a exposiciones temporales y auditorios para llevar a cabo espectáculos culturales y salas para talleres. Fue construido durante 1969, con la finalidad de ser un lugar común para la recreación y la cultura de los habitantes de Xochimilco."
413,413,Casa de Cultura Teatro Carlos Pellicer,,ruggiro_60@yahoo.com.mx,Ciudad de México,Xochimilco,http://sic.gob.mx/ficha.php?table=centro_cultural&table_id=1544,
414,414,Casa de la Cultura San Mateo Xalpa,,culturaxalpa@hotmail.com,Ciudad de México,Xochimilco,http://sic.gob.mx/ficha.php?table=centro_cultural&table_id=1541,26 de noviembre de 1986
415,415,Conjunto Cultural Tepalcatlalpan,https://www.facebook.com/Conjunto-cultural-tepalcatlalpan-1501661066820100/,,Ciudad de México,Xochimilco,http://sic.gob.mx/ficha.php?table=centro_cultural&table_id=2159,9 de septiembre de 2009
416,416,La Calaca Espacio Cultural,https://lacalacacultural.wordpress.com/?fbclid=IwAR3JBegjreoUi2KcRi69cdGLk04fUOUpaLrJWHv1tiqbmQsb8yS7UL8Wue4,lacalaca.mex@gmail.com,Ciudad de México,Benito Juárez,http://sic.gob.mx/ficha.php?table=centro_cultural&table_id=3329,
417,417,Casa de Cultura Letrán Valle,http://www.delegacionbenitojuarez.gob.mx/conoce-bj/casas-de-cultura,ccult.letranvalle@gmail.com,Ciudad de México,Benito Juárez,http://sic.gob.mx/ficha.php?table=centro_cultural&table_id=1248,"El predio en el que se construyó el edificio que hoy alberga la casa de cultura Letrán Valle, era un terreno baldío, y perteneció a la Dra. Q. B. P. Judith Calderón, quien lo donó a la Delegación Benito Juárez para la construcción del centro. Las instalaciones fueron inauguradas en septiembre de 1979 por el entonces Delegado de Benito Juárez, Lic. Arturo Llorente Martínez, quien fungía como responsable del área cultural y los representantes de la Asociación de Residentes de la Colonia Letrán Valle: la misma Dra. Q.B.P. Judith Calderón de Flores y el Dr. Q.B.P. Sergio Flores Palacios."
418,418,Centro Cultural Luis Buñuel,,,Ciudad de México,Benito Juárez,http://sic.gob.mx/ficha.php?table=centro_cultural&table_id=2586,"Es sede de la Federación Iberoamericana de Academias de Cine (Fiacine) y de la Academia Mexicana de Artes y Ciencias Cinematográficas (AMACC). El inmueble ubicado en la colonia Del Valle fue habitado a partir de 1952 por el cineasta, después de naturalizarse mexicano en 1949. Ahora, es un espacio de difusión, fomento y enseñanza de las artes y ciencias cinematográficas."
419,419,Centro Cultural Iztaccíhuatl,,,Ciudad de México,Benito Juárez,http://sic.gob.mx/ficha.php?table=centro_cultural&table_id=1221,21 de mayo de 1992
420,420,"Centro Cultural Quilombo Cultural Brasil–México, FICA",,leo23zap7@gmail.com,Ciudad de México,Benito Juárez,http://sic.gob.mx/ficha.php?table=centro_cultural&table_id=2033,"El inmueble fue adaptado para albergar a Quilombo Cultural Brasil – México, FICA."
421,421,Radio UNAM,http://www.radiounam.unam.mx/,fes@servidor.unam.mx,Ciudad de México,Benito Juárez,http://sic.gob.mx/ficha.php?table=centro_cultural&table_id=1232,11 de octubre de 1976
422,422,Centro Cultural San Francisco del INAPAM,https://www.gob.mx/inapam/acciones-y-programas/centros-culturales-inapam,,Ciudad de México,Benito Juárez,http://sic.gob.mx/ficha.php?table=centro_cultural&table_id=1243,2 de mayo de 1994
423,423,Centro Cultural Aragón (INAPAM),https://www.gob.mx/inapam/acciones-y-programas/centros-culturales-inapam,aragon00@live.com.mx,Ciudad de México,Benito Juárez,http://sic.gob.mx/ficha.php?table=centro_cultural&table_id=1245,"El inmueble se empezó a construir en 1960 y fue adaptado para albergar al Centro Cultural Aragón.
Tipo de público al que está dirigido el centro cultural: Especializado
Asistencia promedio mensual de visitantes: 350 personas
Asistencia total de visitantes en el año 2013: 4,200 personas"
424,424,Centro Vlady,http://www.uacm.edu.mx/uacm/UACM/Plantelesysedes/CentroVlady.aspx#80141192-centro-vlady,centrovlady@gmail.com,Ciudad de México,Benito Juárez,http://sic.gob.mx/ficha.php?table=centro_cultural&table_id=1974,"Inmueble de aspecto rústico de un piso cuyos cuartos están distribuidos alrededor de un patio central que era un espacio de descanso a principios del siglo XX. Con el tiempo pasó a ser parte del ayuntamiento de Mixcoac y albergó los separos para retener a las personas antes de ser procesadas. Posteriormente perteneció a la Secretaría de Desarrollo Urbano y Vivienda, que lo usó como archivo. La Universidad Autónoma de la Ciudad de México lo recibió del Gobierno del Distrito Federal. El espacio se inaugura con Vlady: exposición antológica, que ofreció una semblanza del artista por medio de fotografías, dibujos, pintura y cuadernos.
Tipo de público al que está dirigido el centro cultural: General
Asistencia promedio mensual de visitantes: 260 personas
Asistencia total de visitantes en el año 2012: 3,500 personas"
425,425,Raíces Centro Cultural,http://www.raicescentrocultural.com/,somos@raicescentrocultural.com,Ciudad de México,Benito Juárez,http://sic.gob.mx/ficha.php?table=centro_cultural&table_id=3294,"Es un espacio que propicia la inclusión social, preservación cultural y creación artística entre los integrantes de la comunidad, utilizando como motivación las raíces mexicanas, entre las principales, las de pueblos originarios. Es un lugar de encuentro que articula distintos sistemas simbólicos, haciendo un vínculo necesario entre la modernidad y la tradición a través de manifestaciones culturales entre las que destacan: gastronomía, artesanía, literatura, teatro, música y danza. Cuenta con restaurant de comida mexicana."
426,426,Polyforum Siqueiros,http://www.polyforumsiqueiros.com.mx,dircultura@polyforumsiqueiros.com.mx,Ciudad de México,Benito Juárez,http://sic.gob.mx/ficha.php?table=centro_cultural&table_id=1242,"Espacio cultural construido exprofeso para albergar el mural más grande del mundo titulado La marcha de la humanidad, obra en la que David Alfaro Siqueiros, último representante del muralismo mexicano del siglo XX, aplicó la teoría de la poliangularidad.
La obra plástica que cubre las paredes del Polyforum Siqueiros fue realizada con novedosas técnicas y materiales, entre las que se encuentran la escultopintura, la utilización de acrílicos y piroxilinas sobre armazones de asbestocemento, además de esculturas en hierro.
En su exterior se pueden apreciar 12 paneles para igual número de obras plásticas, que en total suman 6,300 metros cuadrados. Dentro del Polyforum, en la bóveda siqueiriana, con plataforma giratoria y capacidad para mil espectadores, se disfruta de un espectáculo de luz y música, acompañado por la propia voz de Siqueiros. A la par que gira la plataforma, el autor hace una narración de La marcha de la humanidad.
En sus instalaciones se encuentra un teatro con escenario circular con capacidad para 500 espectadores; la galería Dr. Atl, que actualmente funciona como museo de sitio y que exhibe fotografías, maquetas e información biográfica tanto del empresario Manuel Suárez como del pintor David Alfaro Siqueiros; la galería Mario Orozco Rivera, en donde se montan exposiciones temporales de pintura, escultura o fotografía."
427,427,"Acroyoga, Pan y Circo",,carlosyoltic@gmail.com,Ciudad de México,Benito Juárez,http://sic.gob.mx/ficha.php?table=centro_cultural&table_id=3338,Centro cultural enfocado en disciplinas artísticas y deportivas así como un gran interés por las artes culinarias.
428,428,Centro Cultural Juan Rulfo,,econtacto@dbj.gob.mx; jose.torrens@dbj.gob.mx,Ciudad de México,Benito Juárez,http://sic.gob.mx/ficha.php?table=centro_cultural&table_id=1222,"El inmueble data del siglo XX. Es un edificio arquitectónico de estilo porfiriano, construido por órdenes del General Díaz en 1912 para ser ocupado por la prefectura política y municipal de Mixcoac. En su momento, el edificio fue despacho del señor Merced Gómez, Presidente Municipal de Mixcoac y colaborador cercano del perpetuo poder. Fue testigo del cautiverio y juicio de José de León y Toral y la Madre Conchita por el asesinato del general Álvaro Obregón. Se estableció el primer Ayuntamiento y fue sede de la Delegación Benito Juárez.
Según la historia oral, la casa de cultura inició sus actividades en el año de 1975, es considerada la primera de la ciudad de México; fue conocida en esa época como Casa de Cultura Mixcoac. En 1979 el artista Francisco Othon Eppens Helguera plasma su obra en un mural que se encuentra en la entrada principal. En 1986 se le nombra Centro Cultural Juan Rulfo en homenaje póstumo al escrito mexicano.

Fue remodelada y se reinauguró el 22 de febrero de 2020."
429,429,Centro Recreativo y Cultural Alicia Santillana de Guajardo,http://www.delegacionbenitojuarez.gob.mx/nuestra-demarcacion/casas-de-cultura,,Ciudad de México,Benito Juárez,http://sic.gob.mx/ficha.php?table=centro_cultural&table_id=1206,"El predio fue donado por el General Guajardo quien pidió que el centro fuera llamado Quinta Alicia, en honor a su esposa, el nombre actual es Centro Recreativo y Cultural Alicia Santillana de Guajardo. Se inauguró el 4 de Noviembre de 1986."
430,430,Casa de Cultura Niños Héroes,http://www.delegacionbenitojuarez.gob.mx/nuestra-demarcacion/casas-de-cultura,,Ciudad de México,Benito Juárez,http://sic.gob.mx/ficha.php?table=centro_cultural&table_id=1219,Fue inaugurada a petición de los vecinos de la colonia Niños Héroes de Chapultepec y Américas Unidas.
431,431,Centro Cultural Nativitas,http://www.delegacionbenitojuarez.gob.mx/nuestra-demarcacion/casas-de-cultura,centroculturalnativitas@yahoo.com.mx,Ciudad de México,Benito Juárez,http://sic.gob.mx/ficha.php?table=centro_cultural&table_id=1185,"Inicialmente era una casa-habitación, misma que fue adaptada para albergar al Centro Cultural Nativitas."
432,432,Casa de Cultura Moderna,http://www.delegacionbenitojuarez.gob.mx/nuestra-demarcacion/casas-de-cultura,,Ciudad de México,Benito Juárez,http://sic.gob.mx/ficha.php?table=centro_cultural&table_id=1220,"La Delegación ya tenía planeado hacer este proyecto de casa de cultura, y se tenía contemplado que fuera de dos pisos, pero no se llevó a cabo por cuestiones de presupuesto.
La difusión que se hizo en torno a los talleres no sólo abarcó la colonia Moderna, también llegó a las colonias Viaducto Piedad, Iztaccíhuatl, Villa de Cortés y Álamos, pues, debido a la cercanía del metro Xola y bases de microbuses, se benefició a los vecinos de las delegaciones Iztacalco, Iztapalapa y Cuauhtémoc."
433,433,Casa de Cultura Gaby Brimmer,http://www.delegacionbenitojuarez.gob.mx/nuestra-demarcacion/casas-de-cultura,,Ciudad de México,Benito Juárez,http://sic.gob.mx/ficha.php?table=centro_cultural&table_id=1199,"En septiembre de 1981 fue Casa de la Cultura de Portales Oriente y Miravalle, con fecha 13 de noviembre de 1995 cambió de nombre a Casa de Cultura Gaby Brimmer"
434,434,Casa de Cultura Zacahuitzco,http://www.delegacionbenitojuarez.gob.mx/nuestra-demarcacion/casas-de-cultura,,Ciudad de México,Benito Juárez,http://sic.gob.mx/ficha.php?table=centro_cultural&table_id=1207,"Un lugar pequeño donde fomentan a los vecinos de la colonia Zacahuitzco a involucrarse en eventos culturales, actividades cívicas y teatrales."
435,435,Casa de la Cultura Álamos Postal,http://www.delegacionbenitojuarez.gob.mx/nuestra-demarcacion/casas-de-cultura,alamosp806@gmail.com,Ciudad de México,Benito Juárez,http://sic.gob.mx/ficha.php?table=centro_cultural&table_id=1195,"La creación de esta casa se llevó a cabo por la iniciativa de los comités de colonos de las colonias Álamos y Postal, junto con la colaboración de las autoridades delegacionales."
436,436,Centro Cultural La Pirámide,http://www.cultura.cdmx.gob.mx/recintos/archivo-historico/centros-culturales/cclp,lapiramidecentrocultural@gmail.com,Ciudad de México,Benito Juárez,http://sic.gob.mx/ficha.php?table=centro_cultural&table_id=1226,"El Centro Cultural La Pirámide inició su actividad a comienzos de los años noventa con el nombre de Centro Cultural Luis G. Basurto. Durante varios lustros el espacio fue sede de la Asociación de Escritores de México, A.C. En el año 2002 los integrantes de esta asociación presentaron a la mesa directiva el proyecto “La Pirámide”, del cual deriva su nombre actual. En 2015 el recinto fue adscrito a la Secretaría de Cultura de la Ciudad de México, dependencia que se encarga desde entonces de su administración. El Centro Cultural La Pirámide ha sido un espacio generador de propuestas artísticas y culturales diversas, digno ejemplo de la riqueza cultural de la Ciudad de México. En él se han impulsado los movimientos dancísticos africanos y afrocaribeños, así como la danza aérea, los cuales posteriormente se expandieron a otros espacios. La Pirámide es un centro incluyente, abierto, promotor de los derechos humanos y culturales. Trabaja en favor de la difusión del conocimiento. Mediante sus prácticas artísticas y culturales se impulsa la solidaridad, la colaboración, la economía social, la recuperación del espacio público, la incidencia social y la creación de ciudadanía. Los principios que lo rigen son la solidaridad, la ética, la colaboración y la inclusión. La Pirámide propone y promueve modelos de gestión cultural que se caracterizan por considerar el arte y la cultura como una herramienta de transformación social, que favorece procesos de integración social y corresponsabilidad."
437,437,Casa de Cultura del Periodista,http://www.delegacionbenitojuarez.gob.mx/nuestra-demarcacion/casas-de-cultura,,Ciudad de México,Benito Juárez,http://sic.gob.mx/ficha.php?table=centro_cultural&table_id=1181,"Ubicada en un predio donado por los vecinos de la colonia 2ª. del Periodista, el nombre de esta casa se debe a una característica muy especial de la colonia: la mayoría de los vecinos son periodistas y escritores, es por ello que encontramos a su alrededor calles que llevan los nombres de Monosabio, Nigromante, Zutano, Dalevuelta, entre otros, es decir, seudónimos de periodistas notables."
438,438,Centro Cultural La Granada,http://www.lagranada.com.mx,info@lagranada.com.mx,Ciudad de México,Benito Juárez,http://sic.gob.mx/ficha.php?table=centro_cultural&table_id=2893,"El inmueble fue adaptado para albergar al Centro Cultural La Granada.

Tipo de público al que está dirigido el centro cultural: General"
439,439,Centro Cultural Del Valle Sur,http://www.delegacionbenitojuarez.gob.mx/conoce-bj/casas-de-cultura,els.sal.gar@gmail.com,Ciudad de México,Benito Juárez,http://sic.gob.mx/ficha.php?table=centro_cultural&table_id=1211,1 de noviembre de 1994
440,440,"Centro Cultural Coyoacán, Centro de Recreación Infantil del ISSSTE",http://www.issste.gob.mx,culturalcoyoacan@issste.gob.mx; lorena.el7@gmail.com,Ciudad de México,Benito Juárez,http://sic.gob.mx/ficha.php?table=centro_cultural&table_id=2465,
441,441,Centros Culturales Miguel Alemán del ISSSTE,http://www.issste.gob.mx,joselmejia@issste.gob.mx,Ciudad de México,Benito Juárez,http://sic.gob.mx/ficha.php?table=centro_cultural&table_id=2468,1 de septiembre de 1988
442,442,Centro de Música de Concierto (CMC),http://www.sacm.org.mx/mmc/conocenos.html,,Ciudad de México,Benito Juárez,http://sic.gob.mx/ficha.php?table=centro_cultural&table_id=1251,1 de enero de 2000
443,443,Centro Cultural Cuauhtémoc del INAPAM,https://www.gob.mx/inapam/acciones-y-programas/centros-culturales-inapam,zzerolod@gmail.com,Ciudad de México,Benito Juárez,http://sic.gob.mx/ficha.php?table=centro_cultural&table_id=1254,15 de agosto de 1994
