,Unnamed: 0,Nombre,Página Web,Email,Entidad,Municipio,Enlace SIC,Descripción
1426,1426,Casa de Cultura  Atencingo,,presichietla_2014@hotmail.com,Puebla,Chietla,http://sic.gob.mx/ficha.php?table=centro_cultural&table_id=2834,"Villa de Atencingo (también llamada Atencingo), forma parte del municipio de Chietla, en el estado de Puebla. Es la mayor población del municipio, pues posee según el censo de 2010, 15,768 habitantes. Forma parte de la región del valle de Matamoros. Atencingo quiere decir: ""Lugar a la Orilla del Río"". De 1920 a 1962 Atencingo era tan solo administrado por inspectores del municipio.
De 1962 a 2010 estuvo con el cargo de inspectoria auxiliar y el 2 de diciembre de 2010 hasta hoy en día como VILLA ATENCINGO."
1427,1427,Casa de la Cultura Ve`e Xin Kunduutna`anda,,peraltaramosjoseluis@gmail.com,Puebla,Chigmecatitlán,http://sic.gob.mx/ficha.php?table=centro_cultural&table_id=846,"Reseña Histórica:
Fue fundada en la época prehispánica por grupos nahuas, fue sometida alrededor de 1521 por los españoles. A fines del siglo XIX perteneció al antiguo distrito de Tecali y en 1895 fue constituido como Municipio Libre.
La cabecera municipal es el pueblo de Chigmecatitlán."
1428,1428,Casa de la Cultura Lorenzo Rivera Galindo,http://www.chignahuapan.gob.mx/,mmejorada67@hotmail.com,Puebla,Chignahuapan,http://sic.gob.mx/ficha.php?table=centro_cultural&table_id=2264,"Chignahuapan es un Pueblo Mágico poblano que te enamora con un clima semifrío, con lluvias en verano y neblina en las partes más altas."
1429,1429,Casa de la Cultura Xochipatli,http://chignautla.gob.mx/Vista/index.php, contacto@chignautla.gob.mx,Puebla,Chignautla,http://sic.gob.mx/ficha.php?table=centro_cultural&table_id=2267,"Chignautla se localiza en el noreste del estado de Puebla, sus coordenadas geográficas son los paralelos 19º 39'18"" y 19º 51'12"" de latitud Norte, y los meridianos 97º 22'18"" y 97º 29' 4"" de Longitud Occidental. Limita al norte con el municipio de Hueyapan, al oriente con Teziutlán y Xiutetelco, al sur con Tepeyahualco y Cuyoaco, y al poniente con Tlatlauquitepec, Atempan y Teteles de Ávila Castillo. Ocupa una superficie de 104.61 kilómetros cuadrados, la cual lo ubica en el 120 lugar con respecto a los demás municipios del estado."
1430,1430,Casa de la Cultura Richar Honey,https://www.honey.gob.mx/contacto.php,secretariamunicipal@honey.gob.mx,Puebla,Honey,http://sic.gob.mx/ficha.php?table=centro_cultural&table_id=2269,2 de febrero de 1998
1431,1431,Casa de la Cultura Octavio Paz,,,Puebla,Domingo Arenas,http://sic.gob.mx/ficha.php?table=centro_cultural&table_id=826,5 de septiembre de 1999
1432,1432,Casa de la Cultura Mixtlán,,,Puebla,Esperanza,http://sic.gob.mx/ficha.php?table=centro_cultural&table_id=820,23 de octubre de 1998
1433,1433,Casa de Cultura Metlaltoyucan,,,Puebla,Francisco Z. Mena,http://sic.gob.mx/ficha.php?table=centro_cultural&table_id=3318,"Con la construcción de la casa de Cultura en la localidad de Metlaltoyuca, se tendrán los siguientes beneficios:
Fortalecerá la valoración de las diversas expresiones de cultura popular.
Mejoramiento de la infraestructura para garantizar la calidad de sus servicios al público.
Se multiplicaran las opciones y modalidades de formación artística.
Reforzamiento del papel de la biblioteca pública como centro de lectura.
Ampliar el acceso a la información electrónica en la biblioteca pública.
Afirmar el valor cultural como un medio o un fin para el desarrollo social.
Promover el reconocimiento creciente de las libertades y los derechos culturales como nueva dimensión de los derechos fundamentales.
Consolidar acciones de movilidad y promoción de bienes y servicios culturales para fortalecer y normalizar el espacio cultural de la región.
Fortalecer y reafirmar la identidad regional, estatal y nacional.
Fortalecimiento de procesos locales para la formación artística y cultural de los niños y jóvenes de las localidades del municipio"
1434,1434,Casa de Cultura Étnica Cuauhquechollan,,sichuaquechula@gmail.com,Puebla,Huaquechula,http://sic.gob.mx/ficha.php?table=centro_cultural&table_id=3086,La casa de cultura surgió de la inquietud de tener un espacio para fomentar las tradiciones de Huaquechula en la comunidad
1435,1435,Casa de la Cultura Kalixtlamaxtilis,,huatlatlauca2011@hotmail.com ,Puebla,Huatlatlauca,http://sic.gob.mx/ficha.php?table=centro_cultural&table_id=2273,14 de noviembre de 2002
1436,1436,Casa de la Cultura In Xochitl In Cuicatl,,,Puebla,Huauchinango,http://sic.gob.mx/ficha.php?table=centro_cultural&table_id=2274,6 de agosto de 1996
1437,1437,Casa de la Cultura Huehueteotl,,,Puebla,Huehuetlán el Chico,http://sic.gob.mx/ficha.php?table=centro_cultural&table_id=2275,"En la mitología azteca uno de los más antiguos dioses a los que se rendía culto, era Huehuetéotl dios del fuego, en todas las áreas de mesoamérica, se le representaba como un anciano con gran sabiduría obtenida por la experiencia de los años. Dios viejo, dueño del tiempo, el abuelo divinidad sagrada del fuego, con grandes conocimientos y sabiduría, que transmite a sus adoradores. Está relacionado con el calendario solar, se le representaba como un anciano arrugado y encorvado por el paso de los años, con largas barbas y a su boca le faltan dientes, se le representa sentado con un enorme brasero de fuego en la espalda, en ocasiones el solo brasero era la representación simbolica del dios. En México bajo la influencia cultural de la Iglesia católica las creencias se mezclaron y es interpretado por el pueblo Nauthal como Dios Padre. Huehuetéotl residía en el centro del Universo y desde allí se relacionaba con los puntos cardinales, uno de sus símbolos era la cruz de los cuatro rumbos del universo o quincunce, que partían del centro donde él residía. Según la tradición al momento de nacer, Huehuetéotl, recibió el espíritu alentador de la Serpiente de Fuego Xiuhtecuhtli, para protegerlo y guiarlo, este espíritus Nahual, se manifiestan sólo como una imagen que aconseja en sueños o con cierta afinidad al animal que nos tomó como protegidos. ."
1438,1438,Casa de la Cultura Miguel Jerónimo Martínez,http://huejotzingo.gob.mx/,(227) 276 21 12,Puebla,Huejotzingo,http://sic.gob.mx/ficha.php?table=centro_cultural&table_id=2277,13 de agosto de 1996
1439,1439,Casa de la Cultura José Martín Selvas,,psiquesoyer@hotmail.com ,Puebla,Hueyapan,http://sic.gob.mx/ficha.php?table=centro_cultural&table_id=2278,17 de junio de 1995
1440,1440,Casa de la Cultura Hueytamalco,,biblioteca_hueytamalco@hotmail.com,Puebla,Hueytamalco,http://sic.gob.mx/ficha.php?table=centro_cultural&table_id=2279,6 de julio de 2005
1441,1441,Casa de la Cultura Huitzilcalli,,,Puebla,Huitziltepec,http://sic.gob.mx/ficha.php?table=centro_cultural&table_id=2280,"Solamente realizamos talleres de lectura, en Diciembre Taller de piñatas, bailables cuando se acerca alguna festividad como 5 de Mayo, 10 de Mayo, 15 de Septiembre y la pastorela en Diciembre."
1442,1442,Casa de la Cultura Chasen Chujni Nguiva,,,Puebla,Ixcaquixtla,http://sic.gob.mx/ficha.php?table=centro_cultural&table_id=2281,17 de abril de 1996
1443,1443,Casa de Cultura Ixcaquichicatla,,,Puebla,Ixcaquixtla,http://sic.gob.mx/ficha.php?table=centro_cultural&table_id=2793,"Hallazgo Arquológico Popoloca
12 de Diciembre Noche del Maíz
Carnaval Huehues
Día de Muertos
Semana Santa"
1444,1444,Casa de la Cultura Ixtacamaxtitlán,,,Puebla,Ixtacamaxtitlán,http://sic.gob.mx/ficha.php?table=centro_cultural&table_id=2282,9 de julio de 2009
1445,1445,Casa de Cultura Josefina Esparza Soriano,,casadcultura@hotmail.com,Puebla,Izúcar de Matamoros,http://sic.gob.mx/ficha.php?table=centro_cultural&table_id=2838,"En 1740, fue terminado el Convento Hospital de Nuestra Señora de los Dolores, de la orden de los (Juaninos). Para 1849 los Frailes Juaninos abandonan el hospital y a partir de 1850, el nosocomio quedó a cargo del H. Ayuntamiento.
Aproximadamente en el año de 1978 se inician actividades como: Casa de Cultura."
1446,1446,Casa de la Cultura Jonotla,,turismo_jonotla@hotmail.com,Puebla,Jonotla,http://sic.gob.mx/ficha.php?table=centro_cultural&table_id=1747,23 de septiembre de 1999
1447,1447,Casa de la Cultura Carmen Serdán,,,Puebla,Juan C. Bonilla,http://sic.gob.mx/ficha.php?table=centro_cultural&table_id=2284,2 de junio de 1997
1448,1448,"Casa de la Cultura Atl, Tanamitl Yult, Can",,,Puebla,Juan N. Méndez,http://sic.gob.mx/ficha.php?table=centro_cultural&table_id=2285,14 de junio de 2005
1449,1449,Casa de la Cultura Nahui-Ollin,http://www.libres.gob.mx/,sabes_mar@hotmail.com,Puebla,Libres,http://sic.gob.mx/ficha.php?table=centro_cultural&table_id=2286,8 de agosto de 1994
1450,1450,Casa de la Cultura Nido de Gorriones,,yeni_agos_13@hotmail.com ,Puebla,Molcaxac,http://sic.gob.mx/ficha.php?table=centro_cultural&table_id=2287,16 de diciembre de 1994
1451,1451,Casa de Cultura Nahue Otle,,,Puebla,Naupan,http://sic.gob.mx/ficha.php?table=centro_cultural&table_id=2783,
1452,1452,Casa de la Cultura Nahuiopan,,,Puebla,Naupan,http://sic.gob.mx/ficha.php?table=centro_cultural&table_id=2288,19 de agosto de 1994
1453,1453,Casa de la Cultura de Nealtican,,bp3165@dgb.conaculta.gob.mx,Puebla,Nealtican,http://sic.gob.mx/ficha.php?table=centro_cultural&table_id=928,13 de mayo de 1995
1454,1454,Casa de la Cultura de Nopalitzin,,,Puebla,Nopalucan,http://sic.gob.mx/ficha.php?table=centro_cultural&table_id=915,28 de mayo de 1996
1455,1455,Casa de la Cultura Antonio Briones García,,,Puebla,Ocotepec,http://sic.gob.mx/ficha.php?table=centro_cultural&table_id=2289,29 de septiembre de 2000
1456,1456,Casa de la Cultura Frida Kahlo,,,Puebla,Pahuatlán,http://sic.gob.mx/ficha.php?table=centro_cultural&table_id=37,21 de septiembre de 1996
1457,1457,Casa de la Cultura Pantepec,,cane.xx@hotmail.com,Puebla,Pantepec,http://sic.gob.mx/ficha.php?table=centro_cultural&table_id=1763,27 de abril de 2002
1458,1458,Casa de la Cultura Leonel Herrera García,,,Puebla,Petlalcingo,http://sic.gob.mx/ficha.php?table=centro_cultural&table_id=2290,3 de mayo de 1996
1459,1459,Casa de la Cultura Gral. Jesús Chávez Cabrera,,,Puebla,Piaxtla,http://sic.gob.mx/ficha.php?table=centro_cultural&table_id=2291,5 de agosto de 1999
1460,1460,La Casa del Escritor de Puebla,http://www.mexicoescultura.com/recinto/49991/Casa%20del%20Escritor%20-%20Puebla.html#.VFvkeRZcmm0,direcciondeliteraturapuebla@yahoo.com ,Puebla,Puebla,http://sic.gob.mx/ficha.php?table=centro_cultural&table_id=2184,"Es un Centro de actividades culturales, un detonador de literatura. Por sus habitaciones han pasado infinidad de escritores, algunos de ellos: Beatriz Espejo, María Mendoza, Mónica Lavín, Jaime Augusto Shelley, Teodoro Villegas, Vicente Quirarte, Hernán Lavín Cerda, Sandro Cohen y muchos más. Es un punto de encuentro literario, donde talleristas, autores locales y venidos de otras ciudades se dan cita."
1461,1461,Centro Cultural Crear  AC,,crearac@hotmail.com-crearte_2005@yahoo.com.mx,Puebla,Puebla,http://sic.gob.mx/ficha.php?table=centro_cultural&table_id=2024,"Ha impartido más de 300 talleres para niños; más de 2000 representaciones teatrales, así como conferencias y talleres diversos. Obtuvó apoyos del PACMYC en 1996 y 2002."
1462,1462,Culturarte Producciones,http://www.culturartepuebla.com,culturartepuebla@hotmail.com; info@culturartepuebla.com,Puebla,Puebla,http://sic.gob.mx/ficha.php?table=centro_cultural&table_id=2955,"Es un espacio cultural donde se imparten cursos de teatro, tv, radio, cine, danza."
1463,1463,Academia de Baile Jessica Puebla,https://www.facebook.com/pg/Academia-de-baile-jessica-574242132634167/about/?ref=page_internal,cordero_752@outlook.com,Puebla,Puebla,http://sic.gob.mx/ficha.php?table=centro_cultural&table_id=2751,
1464,1464,Colegio de Arte Dramático,http://www.todopuebla.com/directorio/colegiodeartedramaticobuap,,Puebla,Puebla,http://sic.gob.mx/ficha.php?table=centro_cultural&table_id=2019,
1465,1465,Centro Cultural Nice Art Galerie,http://www.niceart.biz/html/artist_.html,bettina.griepentrog@web.de<br>niceart@prodigy.net.mx,Puebla,Puebla,http://sic.gob.mx/ficha.php?table=centro_cultural&table_id=2014,"NiceArt Consultoría de Arte fue fundada por la artista alemana Griepentrog-Bettina Wiesner como artista colonia, donde artistas americanos, mexicanos, alemanes y japoneses (pintores, escultoress, músicos, poetas) se reúnen y trabajan en diferentes proyectos artísticos juntos. Una de las actividades más fuertes de la organización, son las exposiciones y conciertos de beneficencia, así como festivales de arte.El"
1466,1466,Casa de la Ópera Angelopolitana,,gromerovilla@hotmail.com,Puebla,Puebla,http://sic.gob.mx/ficha.php?table=centro_cultural&table_id=2023,"El interés primordial, es promover el género operístico y también la afluencia turística cultural en busca de este tipo de eventos."
1467,1467,Academia Cultural y Artística de Puebla,http://acappuebla.com/,contacto@acappuebla.com,Puebla,Puebla,http://sic.gob.mx/ficha.php?table=centro_cultural&table_id=2750,"Somos una escuela de las artes, nacimos hace 20 años como una academia tradicional interdisciplinaria, y hemos continuado ampliando las opciones, buscando siempre que sea divertidas, bien estructuradas, con excelentes maestros y ambiente, así como certificaciones con validez oficial.
Hace 5 años fuimos la primer institución privada en lograr un convenio con el Instituto Nacional de Bellas Artes en toda su historia, para ofrecer en Puebla su Programa Nacional de Escuelas de Iniciación Artística."
1468,1468,Complejo Cultural Universitario,http://www.complejocultural.buap.mx,direccion.ccu@correo.buap.mx,Puebla,Puebla,http://sic.gob.mx/ficha.php?table=centro_cultural&table_id=2098,"El Complejo Cultural Universitario fue inaugurado el día 10 de Noviembre de 2008, como un conjunto de espacios arquitectónicos y plazuelas interactivas, respondiendo al compromiso que la universidad pública nacional tiene para con la sociedad que la nutre y le da vida. Fue concebido y construido como una ventana abierta para la promoción de todas las expresiones culturales, artísticas, científicas y tecnológicas, que nuestra institución genera, y como sede de las mismas expresiones que concurren hacia nosotros como resultado de los convenios con otras instituciones del país y el resto del mundo. En este Complejo Cultural Universitario se concentran los esfuerzos de la Benemérita Universidad Autónoma de Puebla por crear un lugar incluyente que enriquezca la forma en que la comunidad percibe, siente, vive y se relaciona con la cultura, mejorando su calidad de vida.

Tipo de Público al que está dirigido el centro cultural: General

Asistencia promedio mensual de visitantes en el año 2014: 880,637 personas."
1469,1469,Centro Cultural Creciente,https://www.facebook.com/pages/Centro-Cultural-Creciente/112234818787352,,Puebla,Puebla,http://sic.gob.mx/ficha.php?table=centro_cultural&table_id=2012,"El Centro Cultural Creciente se ubica en el perfil de apoyo y divulgación de las artes y la cultura y además apoya a los cafetaleros de la Sierra Norte de Puebla comprando sus productos sin intermediarios y a un precio justo.
Las expresiones culturales que el Centro Cultural Creciente apoya varían desde música, teatro, fotografía, pintura, artes escénicas y literatura. El objetivo es brindar un espacio alternativo para manifestar sus creaciones, así como realizar la divulgación de los grupos y proyectos que se presentan."
1470,1470,Instituto Cultural Poblano,http://www.todopuebla.com/directorio/institutoculturalpoblano,icp.cultura@puebla.gob.mx / secretaria.cultura@puebla.gob.mx,Puebla,Puebla,http://sic.gob.mx/ficha.php?table=centro_cultural&table_id=964,"En el área en el que se encuentran el Paseo Bravo y el Santuario de Guadalupe, se encuentra hoy al Instituto Cultural Poblano. Este impresionante edificio fue construido para albergar originalmente al Colegio de San Francisco Javier, que fuera la última gran construcción que hicieron los Jesuitas en Puebla antes de ser expulsados del país. También fue utilizado como camposanto, cuartel, y después se renovó para servir como Penitenciaria del Estado bajo el plano de José Manzo y terminándose finalmente con la dirección de Eduardo Tamariz. Actualmente el edificio alberga el Archivo General del Estado y es un importante centro cultural donde se realizan numerosas actividades de difusión y promoción de la cultura y las artes."
1471,1471,Casa de la Cultura Juridica de la Suprema Corte de Justicia de Puebla,https://www.scjn.gob.mx/transparencia/OP_CPSAD/2011/Convocatoria%20DGCCJ-CCJ-PUE-004-2011.pdf,,Puebla,Puebla,http://sic.gob.mx/ficha.php?table=centro_cultural&table_id=2748,"Las Casas de la Cultura Jurídica son centros de la Suprema Corte de Justicia de la Nación establecidos en todos los estados de la República, con el objetivo común de servir a los funcionarios del Poder Judicial de la Federación, a la comunidad jurídica y a la
sociedad en general, mediante la promoción de la cultura jurisdiccional y del Derecho, así como a través de los servicios de consulta del patrimonio documental de la institución."
1472,1472,Zónica,https://www.facebook.com/pg/zonicaproductora/about/?ref=page_internal,contacto@zonica.com.mx,Puebla,Puebla,http://sic.gob.mx/ficha.php?table=centro_cultural&table_id=2956,"Como espacio cultural iniciamos las primeras actividades encaminadas a la planeación, producción y difusión de las propuestas nuevas de los artistas jóvenes poblanos, dentro de las artes gráficas y la música.
Para ello hemos estado planeando, organizando y produciendo distintos proyectos en nuestras instalaciones, además de los realizados habitualmente.
Estos proyectos han sido ampliamente difundidos por nosotros en varios medios de comunicación de la ciudad, tanto privados como públicos (radio y televisión tradicional y por Internet, periódicos locales y redes sociales)."
1473,1473,"Centro Internacional en Artes y Ciencias Cinematográficas, A.C.",http://www.cine-arte.net/,admision@cine-arte.net,Puebla,Puebla,http://sic.gob.mx/ficha.php?table=centro_cultural&table_id=2146,"Es un lugar de encuentro para la cultura cinematográfica donde se postulan alternativas creativas vinculadas a la sociedad a través de la promoción, difusión y enseñanza cinematográfica, las artes visuales y los medios de comunicación, así como, el respeto de los derechos y las libertades fundamentales."
1474,1474,Casa de la Cultura de Puebla,http://www.puebla.travel/es/ver-hacer/espacios-de-ocio/item/casa-de-cultura-puebla,casadelacultura_puebla@yahoo.com.mx,Puebla,Puebla,http://sic.gob.mx/ficha.php?table=centro_cultural&table_id=1598,"El inmueble fue adaptado para albergar la Casa de Cultura de Puebla.

Tipo de público al que está dirigida la casa de cultura: General"
1475,1475,Centro Cultural Consejo Puebla de Lectura,https://www.facebook.com/pages/Consejo-Puebla-de-Lectura-A-C/121037598004659,danblues4@gmail.com; lolitaniet@hotmail.com,Puebla,Puebla,http://sic.gob.mx/ficha.php?table=centro_cultural&table_id=2020,"Acervo: más de 8 mil libros.
Cuenta con revistas y sala infantil."
1476,1476,Centro Cultural Alternativo <i>La Cloaca</i>,,beggarpue@yahoo.com.mx,Puebla,Puebla,http://sic.gob.mx/ficha.php?table=centro_cultural&table_id=2015,"En él se realizan actividades de teatro, artes visuales, videoproyecciones y proyectos alternativos."
1477,1477,Centro Cultural ACD,http://www.editacdcultura.com/centro.html,contacto@editacdcultura.com,Puebla,Puebla,http://sic.gob.mx/ficha.php?table=centro_cultural&table_id=2382,"Va más allá de ofrecer servicios editoriales para escritores, cuenta con este Centro Cultural conformado por una galería de arte, el Teatro Melpómene y una sala de capacitación con el afán de servir al desarrollo artístico de la comunidad internacional."
1478,1478,Centro Cultural Cubano Mexicano José Martí A.C.,http://ccjosemarti.blogspot.com/,"cultura_jm@yahoo.com,mx<br>tabaniyo@yahoo.com",Puebla,Puebla,http://sic.gob.mx/ficha.php?table=centro_cultural&table_id=2013,"En el CC José Martí realizamos diversas actividades encaminadas a
difundir la cultura latinoamericana en general, sobre todo la
Cubana, Boliviana, Venezolana y Mexicana."
1479,1479,Casa de Cultura Juan Diaz,https://www.facebook.com/pages/Casa-de-cultura-juan-diaz-quecholac/439350699544669,,Puebla,Quecholac,http://sic.gob.mx/ficha.php?table=centro_cultural&table_id=2845,1 de enero de 1998
1480,1480,Casa de la Cultura Margarita Romo Ayala,,,Puebla,Rafael Lara Grajales,http://sic.gob.mx/ficha.php?table=centro_cultural&table_id=654,26 de agosto de 1996
1481,1481,Casa de la Cultura Tlanezcalli,http://www.sanandrescholula.gob.mx/home.php,tlanezcalli@gmail.com,Puebla,San Andrés Cholula,http://sic.gob.mx/ficha.php?table=centro_cultural&table_id=850,25 de agosto de 1999
1482,1482,Casa de la Cultura Itzamná Teool Temachtiani,,,Puebla,San Gabriel Chilac,http://sic.gob.mx/ficha.php?table=centro_cultural&table_id=389,25 de mayo de 1996
1483,1483,Casa de la Cultura Nuu Davi,,,Puebla,San Jerónimo Xayacatlán,http://sic.gob.mx/ficha.php?table=centro_cultural&table_id=1771,24 de julio de 1997
1484,1484,Casa de la Cultura Silvano Guillermo Castro Barrales,,,Puebla,San Juan Atzompa,http://sic.gob.mx/ficha.php?table=centro_cultural&table_id=1773,14 de enero de 2004
1485,1485,Complejo Cultural Texmeluquense,http://complejoculturaltexmeluquense.blogspot.com/,naveja_lr@hotmail.com; leyaye@hotmail.com,Puebla,San Martín Texmelucan,http://sic.gob.mx/ficha.php?table=centro_cultural&table_id=2293,"Su construcción data de 1852. Antiguamente fue la presidencia municipal y se adaptó para convertirse en casa de cultura. Fue inaugurada como tal el 25 de junio de 2007. En este espacio cultural se presentan eventos musicales, exposiciones artísticas, cine de arte y mucho más.

Horario: lunes a sábado de 8 a 20 hrs. y domingos de 9 a 14 hrs."
1486,1486,Casa de la Cultura San Nicolás de los Ranchos ,http://sannicolasdelosranchos.info/index.php,info@sannicolasdelosranchos.sisfex.com,Puebla,San Nicolás de los Ranchos,http://sic.gob.mx/ficha.php?table=centro_cultural&table_id=1777,23 de febrero de 2006
1487,1487,Casa de la Cultura Cuicacalli,,,Puebla,San Pablo Anicano,http://sic.gob.mx/ficha.php?table=centro_cultural&table_id=2294,7 de febrero de 1996
1488,1488,Complejo Cultural Cholula,,turismoycultura@cholula.gob,Puebla,San Pedro Cholula,http://sic.gob.mx/ficha.php?table=centro_cultural&table_id=2949,"A partir de una remodelación necesaria, la Casa de Cultura del municipio se convirtió en un espacio más completo, con instalaciones dignas, equipadas y modificadas con el cuidado que deben tener los inmuebles del primer cuadro de la ciudad, ya que se trata de un lugar catalogado como patrimonio.

En febrero de 1975 inició como Casa de Cultura de San Pedro Cholula, el 20 de enero de 2016 cambio de nombre a Complejo Cultural Cholula.

El inmueble fue adaptado para albergar al Complejo Cultural.

Tipo de público al que está dirigido el Complejo Cultural Cholula: General

Asistencia promedio mensual de visitantes en el año 2014: 200 personas
Asistencia total de visitantes en el año 2014: 2,000 personas"
1489,1489,Casa de la Cultura Xochipilli,,,Puebla,San Pedro Yeloixtlahuaca,http://sic.gob.mx/ficha.php?table=centro_cultural&table_id=2295,30 de marzo de 2006
1490,1490,Casa de la Cultura Cuayehualulco,,,Puebla,San Salvador el Seco,http://sic.gob.mx/ficha.php?table=centro_cultural&table_id=424,6 de agosto de 1994
1491,1491,Casa de la Cultura Arnulfo Palafox,,casadecultura.arnulfopalafox@hotmail.com,Puebla,Santiago Miahuatlán,http://sic.gob.mx/ficha.php?table=centro_cultural&table_id=777,30 de septiembre de 2005
1492,1492,Casa de la Cultura Sor Juana Inés de la Cruz,http://www.santotomashueyotlipan.gob.mx/,,Puebla,Santo Tomás Hueyotlipan,http://sic.gob.mx/ficha.php?table=centro_cultural&table_id=898,10 de septiembre de 1995
1493,1493,Casa de la Cultura de Tecomatlán,http://www.tecomatlan.gob.mx/,contacto@tecomatlan.gob.mx,Puebla,Tecomatlán,http://sic.gob.mx/ficha.php?table=centro_cultural&table_id=878,1 de junio de 1993
1494,1494,Casa de Cultura Tehuitzin,http://www.tehuitzingo.gob.mx/,,Puebla,Tehuitzingo,http://sic.gob.mx/ficha.php?table=centro_cultural&table_id=2609,"Pintura
Gastronomía
Feria de Quinto Viernes
Casa del Señor Bornardino García"
1495,1495,Casa de Cultura Tepanco de López,,,Puebla,Tepanco de López,http://sic.gob.mx/ficha.php?table=centro_cultural&table_id=2296,1 de enero de 1998
1496,1496,Casa de la Cultura Ex-Colecturía del Diezmo,,,Puebla,Tepeaca,http://sic.gob.mx/ficha.php?table=centro_cultural&table_id=388,1 de enero de 1991
1497,1497,Casa de la Cultura Kaltamachtiloya,https://ayuntamiento-de-tepeojuma.webnode.mx/,presidente.tepeojuma@gmail.com,Puebla,Tepeojuma,http://sic.gob.mx/ficha.php?table=centro_cultural&table_id=2297,31 de marzo de 2006
1498,1498,Casa de Cultura de Tepexi de Rodríguez,,coordinacionregional2@hotmail.com,Puebla,Tepexi de Rodríguez,http://sic.gob.mx/ficha.php?table=centro_cultural&table_id=2792,"El inmueble fue adaptado para albergar la Casa de Cultura Tepexi de Rodríguez.

Tipo de público al que está dirigida la casa de cultura: General

Asistencia promedio mensual de visitantes en el año 2014: 600 personas
Asistencia total de visitantes en el año 2014: 7,200 personas"
1499,1499,Casa de la Cultura Kajne Nguiva,,,Puebla,Tepexi de Rodríguez,http://sic.gob.mx/ficha.php?table=centro_cultural&table_id=2298,5 de octubre de 1996
1500,1500,Casa de la Cultura Cuauhtémoc,,,Puebla,Tepeyahualco de Cuauhtémoc,http://sic.gob.mx/ficha.php?table=centro_cultural&table_id=913,16 de marzo de 1998
