,Unnamed: 0,Nombre,Página Web,Email,Entidad,Municipio,Enlace SIC,Descripción
0,0,Centro Cultural y Café Tercera Llamada,,tercerallamada_arteycafe@hotmail.com,Aguascalientes,Aguascalientes,http://sic.gob.mx/ficha.php?table=centro_cultural&table_id=2889,"El inmueble que ocupa Tercera Llamada originalmente se utilizó como escuela durante varios años. En marzo de 2009 el espacio se remodeló y adaptó para ser utilizado como teatro, así como sede de talleres, cursos, clases, ensayos y presentaciones de teatro, danza, música, poesía, literatura, cine y pintura. Cuenta con cafetería, en donde se ofrecen bebidas y platillos con base en productos mexicanos y orgánicos, así como café y chocolate tradicional. Cabe señalar que todos los espacios culturales de Tercera Llamada se acondicionan a solicitud expresa de las compañías artísticas que así lo soliciten."
1,1,Centro Cultural Los Arquitos,http://www.aguascalientes.gob.mx/temas/cultura,c.culturallosarquitos@gmail.com,Aguascalientes,Aguascalientes,http://sic.gob.mx/ficha.php?table=centro_cultural&table_id=1143,"El inmueble se construyó en el año 1821 y alojó los primeros baños públicos para el repartidero de agua del Ojocaliente, de esta manera se surtía agua a los 13 placeres o tinas y al conjunto de lavaderos. En el año de 1970 comenzó el deterioro del lugar y fue rescatado por el gobierno, que lo declaró patrimonio nacional. Se inauguró como Centro Cultural el 12 de noviembre de 1994."
2,2,"Centro Cultural Aquelarre, la vindicación del ocio",,aquelarreviva@gmail.com,Aguascalientes,Aguascalientes,http://sic.gob.mx/ficha.php?table=centro_cultural&table_id=3333,
3,3,Centro Municipal de Desarrollo Social Colonia La Salud (CEMDES),,evange58@hotmail.com; w.salazar.rule@gmail.com,Aguascalientes,Aguascalientes,http://sic.gob.mx/ficha.php?table=centro_cultural&table_id=2423,"El inmueble fue adaptado para albergar al Centro Municipal de Desarrollo Social Colonia La Salud (CEMDES).

Superficie de construcción: 320 m2

Asistencia promedio mensual de visitantes: 120
Asistencia total de visitantes en el año 2010: 1400"
4,4,Centro de Investigación y Experimentación Gráfica El Obraje,http://www.aguascalientes.gob.mx/temas/cultura/Noticias/boletines/2011/009.aspx,,Aguascalientes,Aguascalientes,http://sic.gob.mx/ficha.php?table=centro_cultural&table_id=1425,"Es una construcción de finales del siglo XIX y principios del siglo XX construida en su mayoría con muros de adobe, ventanas y puertas de madera, piso de mosaico de concreto en color rojo, techos de bóveda, vigueta y cuña, la finca anteriormente era casa habitación y posteriormente fue acondicionada como Museo de Arte Contemporáneo el día 13 de abril de 1991.

Superficie de construcción: 351.04 m2

Asistencia promedio mensual de visitantes: 16 visitantes
Asistencia total de visitantes en el año 2010: 194 visitantes"
5,5,Casa Cultural Netei,http://netei.org,neteiac@gmail.com,Aguascalientes,Aguascalientes,http://sic.gob.mx/ficha.php?table=centro_cultural&table_id=3330,
6,6,Centro de Animación Cultural Casa Jesús Terán Peredo,https://www.facebook.com/Casa-Ter%C3%A1n-203529386336017/,casajesusteran@gmail.com,Aguascalientes,Aguascalientes,http://sic.gob.mx/ficha.php?table=centro_cultural&table_id=1480,"En 1795 empezó la construcción del inmueble y en abril de 1992 fue adaptado para albergar al Centro de Animación Cultural Casa Jesús Terán Peredo.

Casa-habitación donde nació Jesús Terán Peredo, Gobernador del Estado de Aguascalientes en dos periodos, 1849 y 1855, fundador del Instituto Científico y Literario antecedente de la Universidad Autónoma de Aguascalientes y Secretario de Gobernación del presidente Ignacio Comonfort. Mediante decreto publicado en el Diario Oficial de la Federación el 15 de julio de 1986, la casa fue declarada monumento histórico.
En 1991, Año de Jesús Terán Peredo, el Gobierno del Estado de Aguascalientes expropia y restaura la finca entregándosela al Instituto Cultural de Aguascalientes para convertirla en Centro de Animación Cultural Jesús Terán el 25 de abril de 1992."
7,7,Centro de Seguridad Social IMSS Aguascalientes,http://www.imss.gob.mx,jose.padillac@imss.gob.mx,Aguascalientes,Aguascalientes,http://sic.gob.mx/ficha.php?table=centro_cultural&table_id=2454,1 de enero de 1964
8,8,Casa de la Cultura Víctor Sandoval,http://www.aguascalientes.gob.mx/temas/cultura/,direcciongeneralica@aguascalientes.gob.mx,Aguascalientes,Aguascalientes,http://sic.gob.mx/ficha.php?table=centro_cultural&table_id=258,"Los antecedentes históricos de este viejo inmueble se remiten a las primeras décadas del sigo XVII, siendo su primera dueña Doña Jacinta de Ortega, que obtuvo el predio por herencia familiar en 1625, de esta forma la casa fue ocupada por espacio de 54 años.
La casa es adjudicada por vía donación testamentaria, hecha por el bachiller Don Mariano Guerrero, El 7 de agosto de 1840 para la fundación del Convento y Colegio de la Enseñanza. En los años de 1848 a 1850 se construye enfrente del Convento la Capilla (hoy el Conventito o Parroquia del Sagrario), para sus actividades religiosas. En lo que resta del XIX la mansión tiene diferentes usos, aunque seguía funcionando como convento y colegio.
Se sabe por escritos del cronista Topete del Valle que la porción de la esquina era rentada a la Sociedad Católica para el funcionamiento de una Escuela de Niños, en noviembre de 1886 funcionó el Colegio Seminario de Nuestra Señora de Guadalupe, allí estuvo hasta el año de 1914 en que autoridades emanadas de la Revolución, confiscaron la parte del edificio que hacia esquina.
De 1926 a 1965 se establece una Escuela Tipo, por acuerdo de la Secretaria de Educación Pública. El gobierno Estatal decide que se estableciera aquí la Casa de la Cultura, hace un convenio con el Gobierno Federal para que la Escuela Federal Tipo fuera ubicada en otro espacio y en su lugar la Casa de la Cultura.

Superficie de construcción: 2437.67 m2"
9,9,Centro de Artes Visuales,,centrodeartesvisuales@yahoo.com.mx,Aguascalientes,Aguascalientes,http://sic.gob.mx/ficha.php?table=centro_cultural&table_id=2707,1 de enero de 1975
10,10,Macro Espacio para la Cultura y las Artes (MECA),,,Aguascalientes,Aguascalientes,http://sic.gob.mx/ficha.php?table=centro_cultural&table_id=3121,"El MECA está ubicado en los antiguos Talleres de Ferrocarril. Esta industria ferrocarrilera implantada en el estado en 1884, transformó permanentemente la historia económica y social de Aguascalientes, siendo además uno de los espacios más representativos y de mayor fuerza simbólica del patrimonio industrial del estado. La voluntad de revalorizar este espacio en desuso se concretó por primera vez en 2003 con la inauguración de la plaza de las Tres Centurias que reaprovechaba una parte de los talleres para dar lugar al Museo Ferrocarrilero y a un centro de convenciones. Este complejo cultural alberga a el Museo Espacio, el Foro 13 (para congresos y convenciones) un auditorio de usos múltiples, el Taller de la Gráfica Nacional, una Sala de Conciertos sede de la Orquesta Sinfónica de Aguascalientes, dispone también de amplias áreas educativas, en donde se desarrollan talleres artísticos de todos los niveles, impartidos por el Instituto Cultural de Aguascalientes. Igualmente, dentro de las instalaciones del complejo se encuentra el nuevo campus de la Universidad de las Artes, institución pública que ofrece educación superior en las disciplinas de Danza, Teatro, Música y Artes Plásticas y una biblioteca de artes, entre otros equipamientos."
11,11,Centro de Investigación y Estudios Literarios de Aguascalientes Fraguas,http://www.aguascalientes.gob.mx/cultura/,cielafr@gmail.com,Aguascalientes,Aguascalientes,http://sic.gob.mx/ficha.php?table=centro_cultural&table_id=2088,"En 1908 el inmueble fue construido por el Mtro. de obra Refugio Reyes, casa donde nació el célebre músico Alfonso Esparza Oteo. También fungió como casa del Arzobispado. En 2004 el Gobierno del Estado lo otorga al Centro de Investigación y Estudios Literarios de Aguascalientes Fraguas.

Superficie de construcción: 766.43 m2

Asistencia promedio mensual de visitantes: 500
Asistencia total de visitantes en el año 2010: 1,750

Centro organizador del Premio Bellas Artes de Poesía Aguascalientes, Premio Salvador Gallardo Dávalos, Encuentro de Poetas del Mundo Latino extensión Aguascalientes y Premio de Poetas del Mundo Latino Víctor Sandoval."
12,12,Centro Cultural ISSSTE Aguascalientes,http://www.isssteags.gob.mx,ub_issste@hotmail.com; booa_angy@hotmail.com,Aguascalientes,Aguascalientes,http://sic.gob.mx/ficha.php?table=centro_cultural&table_id=1071,"Inicialmente el inmueble fue ocupado por el Sindicato Magisterial de Aguascalientes, se instalaron los talleres gráficos del Sindicato de Maestros, que a la fecha, continúan con sus labores, también estuvo un hotel dando alojamiento a maestros que realizaron algunos estudios como Licenciaturas, estuvo la Tienda Superissste, actualmente alberga al Centro Cultural ISSSTE Aguascalientes.

Asistencia promedio mensual de visitantes: 750 personas
Asistencia total de visitantes en el año 2010: 9,000 personas"
13,13,Centro Cultural Ángel,,centroculturalangel@hotmail.com,Aguascalientes,Aguascalientes,http://sic.gob.mx/ficha.php?table=centro_cultural&table_id=3097,"Es un espacio abierto a todo público, donde se puede desarrollar habilidades artísticas y culturales."
14,14,Centro de Educación Ambiental Cultural y Recreativo El Cedazo,http://www.aguascalientes.gob.mx/ssmaa/areasverdes/cearcedazo.html,elcedazo@aguascalientes.gob.mx,Aguascalientes,Aguascalientes,http://sic.gob.mx/ficha.php?table=centro_cultural&table_id=1144,"El parque nace en el año 1996 con la finalidad de rescatar el área de manantial, conocida como el cedazo, que abastecía a la Villa de Nuestra Señora de la Asunción mediante el Sistema de Conducción de Agua que data del año 1730. Actualmente es uno de los lugares predilectos para la práctica de deportes como fútbol, fútbol soccer infantil, básquetbol, voleibol, tenis y fútbol de salón, además cuenta con un gimnasio al aire libre, ciclo pista, pista para corredores y pista de patinaje extremo donde se organizan concursos de BMX y skate por las tardes. El parque también alberga El Caracol, el único centro paleontológico del estado; a un costado también se encuentra La Casa del Adolescente donde organizan talleres artísticos y deportivos de los que disfruta la comunidad."
15,15,Casa Triana,,casatrianaags@gmail.com,Aguascalientes,Aguascalientes,http://sic.gob.mx/ficha.php?table=centro_cultural&table_id=3346,Talleres de arte en horarios extendidos. Actividades de gestión cultural y venta de artística y artesanal.
16,16,Casa de la Cultura de Asientos,http://www.aguascalientes.gob.mx,asicultura@hotmail.com; ica@aguascalientes.gob.mx,Aguascalientes,Asientos,http://sic.gob.mx/ficha.php?table=centro_cultural&table_id=1579,"El inmueble se empezó a construir en junio de 1997 y a partir de febrero de 1988 alberga la Casa de la Cultura de Asientos.

Superficie de construcción: 146.25 m2

Asistencia promedio mensual de visitantes: 600 personas
Asistencia total de visitantes en el año 2010: 6,500 personas"
17,17,Casa de la Cultura de Calvillo,http://www.aguascalientes.gob.mx,calvillo.ica@gmail.com; ica@aguascalientes.gob.mx,Aguascalientes,Calvillo,http://sic.gob.mx/ficha.php?table=centro_cultural&table_id=1049,5 de diciembre de 1980
18,18,Casa de la Cultura de Cosío,http://www.aguascalientes.gob.mx,coscultura@hotmail.com;  ica@aguascalientes.gob.mx,Aguascalientes,Cosío,http://sic.gob.mx/ficha.php?table=centro_cultural&table_id=1510,"En 1992 el inmueble fue construido exprofeso para albergar la Casa de la Cultura de Cosío.

Superficie de construcción: 655.12 m2"
19,19,Casa de Cultura de Jesús María,http://www.aguascalientes.gob.mx,jmacultura@hotmail.com; ica@aguascalientes.gob.mx,Aguascalientes,Jesús María,http://sic.gob.mx/ficha.php?table=centro_cultural&table_id=1499,3 de julio de 1983
20,20,"Fundación Keriva, A.C.",,kerivaac@gmail.com,Aguascalientes,Jesús María,http://sic.gob.mx/ficha.php?table=centro_cultural&table_id=3350,"Asociación Civil sin fines de lucro, cuyo objetivo es luchar por el desarrollo integral de las personas, fomento a la protección animal y ambiental. Crear espacios armoniosos y situaciones que conlleven a la mejora social."
21,21,Casa de la Cultura de Pabellón de Arteaga,http://www.aguascalientes.gob.mx,pabcultura@hotmail.com; ica@aguascalientes.gob.mx,Aguascalientes,Pabellón de Arteaga,http://sic.gob.mx/ficha.php?table=centro_cultural&table_id=1500,"Anteriormente era un vivero forestal y ante la necesidad de un espacio en donde se impartieran talleres de educación artística, y donde la población tuviera acceso a las bellas artes, desde hace 28 años la casa de la cultura ha atendido y atiende a una buena parte de la población y los grupos artísticos que participan en las festividades de la localidad, así como de las del resto del estado."
22,22,Casa de la Cultura de Rincón de Romos,https://www.facebook.com/pages/Casa-de-la-Cultura-de-Rinc%C3%B3n-de-Romos/1470527289825357?sk=info,rincon.ica@gmail.com,Aguascalientes,Rincón de Romos,http://sic.gob.mx/ficha.php?table=centro_cultural&table_id=513,El inmueble fue construido en el año 1955 y fue adaptado para albergar a la Casa de la Cultura de Rincón de Romos.
23,23,Casa de Cultura de San José de Gracia,http://www.aguascalientes.gob.mx,sanjosedeg.ica@gmail.com; ica@aguascalientes.gob.mx,Aguascalientes,San José de Gracia,http://sic.gob.mx/ficha.php?table=centro_cultural&table_id=1582,"En sus inicios, la Casa de la Cultura estuvo ubicada en una escuela, sin embargo, un tiempo después se cambió al sitio donde hoy se encuentra la Dirección de Agua Potable. En dicho espacio había grandes carencias: las clases se daban en la calle, pues nada más había un salón; para el único baño se tenía que llevar agua desde la plaza y solamente lo podían utilizar las mujeres. A pesar de las vicisitudes del lugar, las actividades continuaron de manera exitosa. Fue gracias a las gestiones de la primera directora, la Mtra. Margarita Martínez Reyes, que se consiguió el espacio que actualmente alberga a esta Casa. Así, en una ceremonia especial el 23 de septiembre de 1994 se entregó a la población el edificio de la Casa de la Cultura. Con esta ceremonia, los josefinos tuvieron ya un local propio para acercarse a las artes y a la cultura.

Tipo de público al que está dirigido el centro cultural: General.

Asistencia promedio mensual de visitantes en 2016: 450 personas
Asistencia total de visitantes en el año 2016: 7,400 personas"
24,24,Casa de la Cultura de Tepezalá,http://www.aguascalientes.gob.mx,tepcultura@hotmail.com; ica@aguascalientes.gob.mx,Aguascalientes,Tepezalá,http://sic.gob.mx/ficha.php?table=centro_cultural&table_id=1583,7 de noviembre de 1998
25,25,Casa de la Cultura de El Llano,http://www.aguascalientes.gob.mx,llacultura@hotmail.com; ica@aguascalientes.gob.mx,Aguascalientes,El Llano,http://sic.gob.mx/ficha.php?table=centro_cultural&table_id=1580,"El inmueble fue construido exprofeso para albergar la Casa de la Cultura de El Llano, la realización de la obra se realizó por parte de la Secretaria de Obras Públicas, hecho por el cual se desconoce el nombre del Arquitecto o Ingeniero Civil que proyectó y construyó la obra. Y es desde el inicio de su memoria que ha sido usado para todo tipo de representaciones artísticas. Desde un Concierto de Piano, hasta la proyección de un video con la historia del Municipio, hay funciones de Encuentros Estatales de Pintura, eventos de carácter cívico, político, social y artístico

Asistencia promedio mensual de visitantes: 350 personas
Asistencia total de visitantes en el año 2010: 5000 personas"
26,26,Casa de Cultura de San Francisco de los Romo,http://www.aguascalientes.gob.mx/temas/cultura/Noticias/Convocatorias/pdf%20casas/talleres2016/7CC%20Rincon%20de%20Romos%20CE2015-2016.pdf,sanpancho.ica@gmail.com,Aguascalientes,San Francisco de los Romo,http://sic.gob.mx/ficha.php?table=centro_cultural&table_id=1581,El inmueble fue construido exprofeso para albergar a la Casa de Cultura de San Francisco de los Romo.
27,27,Centro Cultural Santo Tomás,https://www.facebook.com/CentroCulturalSantoTomas/,jaimedelfin@grupopando.com,Baja California,Ensenada,http://sic.gob.mx/ficha.php?table=centro_cultural&table_id=3091,"El inmueble fue adaptado para albergar al Centro Cultural Santo Tomás y se encuentra en el interior de las Bodegas de Santo Tomás.

Tipo de público al que está dirigida la casa de cultura: General

En 1930 Bodegas de Santo Tomás es adquirida por el Gral. Abelardo l. Rodriguez, y el etnólogo Esteban Ferro decide trasladar la producción del vino del Valle de Santo Tomás a un antiguo edificio de adobe que fue construido en 1913 por la 25 infantería en el municipio de Ensenada y que fue abandonado el año de 1915 cuando se pasa la capital del territorio norte a Mexicali Baja California. Ya en 1995 el señor Antonio Cosío actual dueño de Bodegas de Santo Tomás regresa la producción del vino a su lugar de origen y se destinan los espacios en desuso a la promoción y difusión de actividades artísticas. En el año de 2013 se constituye oficialmente el Centro Cultural Santo Tomas, siendo éste el promotor de la nueva vocación de estos espacios que darán cobijo a las actividades culturales de la entidad."
28,28,Centro Cultural Riviera de Ensenada,http://rivieradeensenada.com.mx/#contacto,eventos@rivieradeensenada.com.mx; alejandra@rivieradeensenada.com.mx,Baja California,Ensenada,http://sic.gob.mx/ficha.php?table=centro_cultural&table_id=3058,Administración mixta.
29,29,Casa de la Cultura Profr. Miguel de Anda Jacobsen,http://www.ensenada.gob.mx,amalia.gaitan@hotmail.com ,Baja California,Ensenada,http://sic.gob.mx/ficha.php?table=centro_cultural&table_id=502,"El inmueble se construyó el 31 de octubre de 1930. La primera Casa de la Cultura de Ensenada se abrió en la vieja casona de Valle Verde, inaugurada por el Gobernador Milton Castellanos y por Roberto de la Madrid. El gestor del proyecto y primer director de casa de la cultura fue el Profr. Miguel de Anda Jacobsen, quien posteriormente fue Director de Asuntos Culturales del estado. La casa de la cultura se reubicó el 17 de noviembre de 1983, dentro del edificio del Centro Cultural Riviera del Pacifico, en unas instalaciones construidas por el gobierno federal, por el Secretario de Sahope el Ing. Roberto Díaz García y bajo la obra del Ing. Humberto Nobel Granados, que fueron los encargados del proyecto y obra de ampliación.

Asistencia promedio mensual de visitantes: 800 personas
Asistencia total de visitantes en el año 2010: 9,600 personas"
30,30,Centro Cultural ISSSTE Ensenada,http://www.issste.gob.mx,tomy_025@hotmail.com,Baja California,Ensenada,http://sic.gob.mx/ficha.php?table=centro_cultural&table_id=985,1 de marzo de 2000
31,31,Centro Estatal de las Artes de Ensenada (CEARTE) ,https://www.facebook.com/CEARTEnsenada/,coordinacioncearte@hotmail.com,Baja California,Ensenada,http://sic.gob.mx/ficha.php?table=centro_cultural&table_id=2112,"El Centro Estatal de las Artes Ensenada (Cearte) inició sus actividades el 31 de julio del 2007. Surge como respuesta a la solicitud que por muchos años habían formulado pintores y otros creadores de diversas áreas del arte y la literatura ante autoridades locales y nacionales.

Forma parte de la Red de Centros de las Artes de la Secretaría de Cultura.

Asistencia total de visitantes al año: 114,000 personas"
32,32,"Meyibó, Centro del Saber",,meyibocs@yahoo.com,Baja California,Mexicali,http://sic.gob.mx/ficha.php?table=centro_cultural&table_id=2604,"El inmueble fue construído exprofeso para albergar al Centro del Saber Meyibó e inaugurado en marzo de 2001. Ofrece capacitación a la ciudadanía para potencializar y enriquecer sus conocimientos ademas de ser un centro que facilita la capacitación y desarrollo personal en las áreas de la ciencia, tecnología, arte y cultura.

Cuenta con grupos de trabajo para personas con capacidades diferentes como: ciegos, débiles visuales y sordos."
33,33,Casa de Cultura del Barrio,,ccnanachela@gmail.com; ccnanachela@hotmail.com,Baja California,Mexicali,http://sic.gob.mx/ficha.php?table=centro_cultural&table_id=2447,"En 1949 el inmueble fue contruído como casa habitación, en 1998 se adaptó para albergar la Casa de Cultura del Barrio.

La Casita de Cultura de Barrio funciona en una construcción y terreno donados por la profesora Soledad Ponce de León Patiño (1900-1997), la que desde muy joven, además de atender su carrera de profesora de educación primaria, contaba cuentos en una estación de radio local, su nombre artístico fue el de Nana Chela. En vida de la maestra se formó la Asociación Civil (21-marzo-96), el terreno y la casa quedó escriturada a nombre del Pueblo de Mexicali, y como albacea la Asociación Civil denominada Centro Cultural Nana Chela, A.C., posteriormente se construyó el local de la biblioteca, la que está integrada a la Red Nacional de Bibliotecas de la Dirección General de Bibliotecas de la Secretaría de Cultura, con el nombre de Soledad Ponce de León. También fue construida La Cocina, un foro al aíre libre y la Ruta del Arte este último anexo para exposiciones y salas de lectura.

Asistencia promedio mensual de visitantes: 450 (alumnos de talleres y cursos sin incluir la biblioteca ni presentaciones artísticas."
34,34,Centro Cultural Ciudad Morelos,http://www.mexicali.gob.mx/imacum/contacto.html,bp1806@dgb.conaculta.gob.mx,Baja California,Mexicali,http://sic.gob.mx/ficha.php?table=centro_cultural&table_id=2606,"El inmueble fue adaptado para albergar al Centro Cultural Ciudad Morelos.


Asistencia promedio mensual de visitantes: 785 personas"
35,35,Centro Cultural Guadalupe Victoria,,bp7363@dgb.conaculta.gob.mx,Baja California,Mexicali,http://sic.gob.mx/ficha.php?table=centro_cultural&table_id=2607,"El inmueble fue adaptado para albergar al Centro Cultural Guadalupe Victoria.

Superficie de construcción: 368 m2

Asistencia promedio mensual de visitantes: 1,153 personas."
36,36,Centro Estatal de las Artes de Baja California,http://www.icbc.gob.mx/,normaceart@gmail.com; ceartbc@gmail.com,Baja California,Mexicali,http://sic.gob.mx/ficha.php?table=centro_cultural&table_id=1041,"El inmueble fue construido exprofeso para albergar al Centro Estatal de las Artes de Baja California. La primera piedra del Ceart se colocó el 14 de noviembre de 2003 y fue inaugurado el 31 de enero del 2005, por el ex presidente de México, Vicente Fox Quesada, y el gobernador Eugenio Elorduy Walther. Al finalizar la inauguración, la Orquesta de Baja California y el grupo de percusiones Tambuco fueron los primeros en tocar en el recinto. La realización del inmueble estuvo a cargo del arquitecto mexicalense Martín Pereida. La primera exposición en el Ceart fue Analogías de color y líneas, con obras de reconocidos artistas del Estado de Baja California. Entre las exposiciones de mayor importancia presentadas en el Ceart se encuentra Rodin en Baja California, en donde se apreciaron las famosas obras El pensador y El beso, del escultor parisino. En octubre del año 2006 se inauguró el Centro de Convenciones y Espectáculos del Ceart demostrando el crecimiento del Centro de las Artes.

Superficie de construcción: 5,615 m2

Asistencia promedio mensual de visitantes: 7,740 personas"
37,37,Casa de Cultura de Mexicali,https://www.facebook.com/CasaDeLaCulturaDeMexicali,casadelaculturamexicali@gmail.com,Baja California,Mexicali,http://sic.gob.mx/ficha.php?table=centro_cultural&table_id=2603,"El edificio de la escuela Cuauhtémoc, hoy casa de cultura, se comenzó a construir en 1915, siendo presidente municipal Francisco L. Montejano, y jefe político del distrito norte de la Baja California, el coronel Esteban Cantú. Se inauguró el 16 de septiembre de 1916, comenzando las clases el 1ro. de noviembre del mismo año, en esa época, la educación elemental en Mexicali llegaba hasta el 4to. grado; dos años después se ampliaría hasta el sexto, cumpliendo con el nombre de Escuela Superior y Mixta Cuauhtémoc. El edificio fue construido de concreto armado y entrepisos de madera y se utilizaron los materiales y técnicas más avanzados de la época, se proyectó específicamente para escuela.
En 1919 se estableció la Escuela de Iniciación Pedagógica que fue antecedente de la normal, al pasar del tiempo, el edificio se usó para otros fines como el de oficinas administrativas, biblioteca y escuelas de la Universidad Autónoma de Baja California. En 1974 se celebra el convenio tripartita entre el gobierno del estado, el Instituto Nacional de Bellas Artes y el Ayuntamiento de Mexicali, instalándose ahí la casa de la cultura en 1998. En la administración de Eugenio Elorduy Walther, se intervino este mismo inmueble, a través de este programa, en una primera fase mediante el cambio y rehabilitación de duelas, iluminación, restauración de plafones, aplanado de muros, iluminación y sustitución de puertas y pintura del pasillo principal, galería y archivo.
En el año 2000, en la administración de Víctor Hermosillo, se apoyó en una segunda fase con la instalación de electricidad y aire acondicionado para todo el inmueble y adquisiciones de mobiliario y equipo para el archivo histórico. El jueves 31 de agosto de 2006, fue declarada patrimonio cultural por el estado.

Superficie de construcción: 1,499.21 m2

Asistencia promedio mensual de visitantes: 3,000 personas"
