,Unnamed: 0,Nombre,Página Web,Email,Entidad,Municipio,Enlace SIC,Descripción
488,488,Teatro Monterrey del IMSS,http://www.teatromonterrey.com.mx,,Nuevo León,Monterrey,http://sic.gob.mx/ficha.php?table=teatro&table_id=242,"Espacio cultural del Instituto Mexicano del Seguro Social, administrado por el Grupo Arte Regiomontano, S.A. de C.V. El inmueble fue inaugurado el 28 de noviembre de 1963. Presenta eventos artísticos de teatro, danza y música."
489,489,Teatro Municipal,http://www.sabinashidalgo.gob.mx,chuy.alvarez@elnarval.com,Nuevo León,Sabinas Hidalgo,http://sic.gob.mx/ficha.php?table=teatro&table_id=723,"Espacio del Ayuntamiento de Sabinas Hidalgo, manejado por la Secretaría de Administración."
490,490,Teatro de la Ciudad de San Nicolás,,j.luis.medellin@hotmail.com,Nuevo León,San Nicolás de los Garza,http://sic.gob.mx/ficha.php?table=teatro&table_id=372,"El teatro pertenece al Ayuntamiento de San Nicolás de los Garza. Fue inaugurado en diciembre de 1991. Presenta temporadas teatrales, obras para niños y conciertos."
491,491,Teatro Nova,https://nova.com.mx,c.rlopezt@ternium.com.mx,Nuevo León,San Nicolás de los Garza,http://sic.gob.mx/ficha.php?table=teatro&table_id=207,"El teatro es administrado por Nova de Monterrey, A.C. y forma parte de las instalaciones del Centro Recreativo Nova. El inmueble fue construido exprofeso por el arquitecto Pedro Ramírez Vázquez e inaugurado el 18 de diciembre de 1978. Es sede de la Compañía Artística Nova, se realizan obras de teatro, espectáculos de danza, conciertos y exposiciones de artes plásticas. Asimismo da cabida a juntas de accionistas, asambleas, simposios, congresos y graduaciones."
492,492,Teatro al Aire Libre,http://www.vitro.com/vitro_corporativo/espanol/portada.htm,clozanor@vitro.com<br>achico@vitro.com,Nuevo León,San Nicolás de los Garza,http://sic.gob.mx/ficha.php?table=teatro&table_id=212,"El espacio pertenece al Grupo Industrial Vitro y forma parte de las instalaciones de Vitro Club, A.C. Fue inaugurado en julio de 1987, es sede de los talleres culturales de la compañía. En él se realizan obras de teatro, revistas musicales y eventos ciudadanos."
493,493,Teatro de la Ciudad,http://www.stacatarina.gob.mx ,culturastacatarina@hotmail.com,Nuevo León,Santa Catarina,http://sic.gob.mx/ficha.php?table=teatro&table_id=721,"Espacio del Ayuntamiento de Santa Catarina, manejado por la Dirección de Cultura municipal."
494,494,La Locomotora Foro Escénico,,forolalocomotora@gmail.com; hola@lalocomotora.mx,Oaxaca,Oaxaca de Juárez,http://sic.gob.mx/ficha.php?table=teatro&table_id=923,"La Locomotora Foro Escénico es un espacio independiente enfocado al desarrollo de las artes escénicas, la recreación y el esparcimiento. En él se desarrollan espectáculos de teatro, danza, cine y exposiciones tanto de corte convencional como alternativo. Siendo además un espacio que invita a la reflexión, análisis, experimentación e intercambio de experiencias escénicas con diversos grupos artísticos y la comunidad. Se imparten cursos y talleres."
495,495,Teatro Macedonio Alcalá,,teatro_alcala@hotmail.com,Oaxaca,Oaxaca de Juárez,http://sic.gob.mx/ficha.php?table=teatro&table_id=2,"En el año de 1903 dieron principio los trabajos de construcción, dicha obra se encomendó al Ing. Rodolfo Franco. Para el 4 de agosto de 1904 se colocó la primera piedra. La entrada principal consta de tres puertas labradas en cantera verde, el vestíbulo resalta por su estilo francés tipo Luís XV con escalinata de mármol blanco y en su cielo raso se admira una bella alegoría que representa el Templo del Arte donde sobresale la Fama y el Premio. El interior es de estilo Imperio en forma de herradura que se distribuyen cómodamente en seis localidades; luneta, platea, palcos primeros, palcos segundos, galería y paraíso. El telón de boca principal luce una bella pintura del Partenón y el monte Parnaso, y en el fondo volando entre nubes el carro de Apolo tirado por cuatro fogosos caballos que guía la Gloria. Rodeando este cuadro aparecen las nueve musas, mismas que vuelven a admirarse en la altura del plafón, en la parte central del proscenio destaca en alto relieve el busto del general porfirista Luis Mier y Terán, pues este teatro llevó originalmente este nombre. Posteriormente en los años 30's se le llamó definitivamente Macedonio Alcalá en honor al sobresaliente autor del vals inmortal Dios nunca muere. Partiendo de este busto y siguiendo la vista en círculo como las manecillas del reloj, observamos nueve medallones con los retratos de artistas y escritores insignes, en primer término Víctor Hugo, Calderón de la Barca, Verdi, Juan Ruíz de Alarcón, Shakespeare, Racinni, Wagner, Moliere y Beethoven. El vestíbulo es de tipo Luís XV, tiene una elegante escalinata de mármol blanco; en sus paredes también blancas, dos artísticos medallones con las alegorías de la música y la poesía; en el cielo raso se ve otra exquisita alegoría que representa el triunfo del arte."
496,496,Teatro Juárez,,contacto@teatrojuarez.org,Oaxaca,Oaxaca de Juárez,http://sic.gob.mx/ficha.php?table=teatro&table_id=554,"El recinto que hoy ocupa este teatro fue utilizado anteriormente por el Congreso del Estado. Luego de su remodelación, el inmueble fue convertido en un óptimo espacio escénico equipado con tecnología de última generación. Una vez concluidas las labores de adecuación, el inmueble fue formalmente inaugurado el 21 de marzo de 2006 con el nombre de Teatro Juárez, en el marco de las celebraciones del Bicentenario del natalicio del Benemérito de las Américas, Lic. Benito Juárez García. Hoy se ha convertido en el foro escénico con mayor actividad en el estado, gracias a su dinámica programación que incluye conciertos, obras teatrales, conferencias y espectáculos infantiles, entre otras actividades."
497,497,Teatro Álvaro Carrillo Alarcón,,pauseculture@oaxaca.gob.mx,Oaxaca,Oaxaca de Juárez,http://sic.gob.mx/ficha.php?table=teatro&table_id=195,"Forma parte de las instalaciones del Centro Cultural Oaxaca. Fue diseñado por el arquitecto Abraham Zabludowsky e inaugurado en 1992. Realiza obras de teatro, ópera, música, danza, espectáculos infantiles, festivales, cine, conferencias, variedades e informes de gobierno. La primera representación fue La Tempestad de William Shakespeare, bajo la dirección de Martín Acosta, escenografía de Sergio Ruiz y los actores Billy Espejo, Félix de Pablo y Octavio Flores."
498,498,Teatro Zonal 21 de Marzo,,teatrozonal21demarzo@gmail. com,Oaxaca,Oaxaca de Juárez,http://sic.gob.mx/ficha.php?table=teatro&table_id=83,2 de mayo de 1985
499,499,Teatro Juan Rulfo,,,Oaxaca,Oaxaca de Juárez,http://sic.gob.mx/ficha.php?table=teatro&table_id=343,1 de enero de 1986
500,500,Teatro al Aire Libre Fundación Rodolfo Morales,http://www.artedeoaxaca.com/obra/obra.php?num_artista=62&num_obra=757,,Oaxaca,Ocotlán de Morelos,http://sic.gob.mx/ficha.php?table=teatro&table_id=196,"Escenario al aire libre construido en el patio trasero de la antigua casa sede del Centro Cultural de la Fundación Cultural Rodolfo Morales, A.C. El conjunto cuenta, además del teatro al aire libre, con biblioteca, sala de cómputo, fonoteca y videoteca.

Algunas de las actividades que programa y ofrece al público son conciertos, exposiciones, conferencias, obras de teatro, cine y taller de artes plásticas para niños y jóvenes, así como la difusión de la obra del maestro Rodolfo Morales (1925-2001), creador de la Fundación y oriundo de Ocotlán de Morelos, Oaxaca.

Ilustración: Rodolfo Morales, Pueblo solitario, litografía 0.60 x 0.78 m, 1994."
501,501,Teatro Auditorio de la Casa de la Cultura Dr. Víctor Bravo Ahuja,,casacult.tuxtepec@gmail.com,Oaxaca,San Juan Bautista Tuxtepec,http://sic.gob.mx/ficha.php?table=teatro&table_id=201,"Forma parte de la Casa de la Cultura Dr. Víctor Bravo Ahuja. Su diseño estuvo a cargo del INBA y CAPFCE. La construcción comenzó en 1975 y fue inaugurado el 20 de mayo de 1979. En 1994 se realizó una remodelación bajo los auspicios del Ayuntamiento, el Gobierno del Estado y Solidaridad, reinaugurándose el 14 de diciembre de ese año. En sus instalaciones se llevan a cabo obras de teatro, música, danza, variedades, espectáculos infantiles, festivales, conferencias, funciones de cine, asambleas e informes de gobierno."
502,502,Teatro Blanco    Directora:  Itandehui Méndez,http://laentradaolarazon.wix.com/cia-teatro-blanco,laentradaolarazon@hotmail.com,Oaxaca,San Pablo Etla,http://sic.gob.mx/ficha.php?table=teatro&table_id=796,Nombre: Detalle de participación: Pavel Scarubi Urbieta Martínez Co-creador de espectáculos artista visual-actor Ernesto Diez Reyes Actor-artista visual Hugo Díaz Actor-comunicólogo Jorge Lemus Iluminador Itandehui Méndez Directora de escena Ofelia Jiménez Vestuarista
503,503,Sala Neeptaajk	,,carapachoteatro@gmail.com,Oaxaca,San Pedro y San Pablo Ayutla,http://sic.gob.mx/ficha.php?table=teatro&table_id=778,"Jefe de foro José Benjamín Cruz El inmueble es propio, fue adaptado y se localiza dentro de otro espacio cultural fue construido en el año de 1993 con piso de madera, los usos que ha tenido desde su construcción ha sido teatro, danza, yoga y música, se llevan a cabo dos espectáculos por año."
504,504,Teatro al Aire Libre Ciudad de las Canteras,http://www.administracion.oaxaca.gob.mx/ciudadcanteras.htm,secretaria.administracion@e-oaxaca.gob.mx,Oaxaca,Santa Lucía del Camino,http://sic.gob.mx/ficha.php?table=teatro&table_id=145,"Ubicado dentro de una gran área recreativa, en la que se localizan diversas zonas de esparcimiento en general, en el Teatro al Aire Libre se realizan funciones de títeres de costal, obras de teatro, monólogos, lectura de cuentos y leyendas tradicionales, encuentros artísticos, muestra de danza, música y gastronomía."
505,505,Teatro Manuel M. Flores,https://www.facebook.com/pages/Teatro-Manuel-M-Flores/503024339730382,,Puebla,Chalchicomula de Sesma,http://sic.gob.mx/ficha.php?table=teatro&table_id=854,"El Teatro se localiza en un inmueble antiguo que fue donado a la comunidad por el Sr. José García Valseca en 1980, quedando bajo responsabilidad del Ayuntamiento.
En 1994, cuando el Ing. Héctor Aguilar Guerra fue director de cultura que se hizo el primer registro de ese lugar como casa de cultura. Él junto con un grupo de muchachos de secundaria, habilitó el espacio para que se pudieran hacer algunas actividades como danza, también hubo una pequeña biblioteca.
Todas las paredes al interior del Teatro están decoradas con pintura mural, que hace alusión a la historia de la región desde la época prehispánica. Las pinturas murales se encuentran aún inconclusas. Esta obra es de Rodrigo Limón Romero y Jesús Altamirano Toledo."
506,506,Teatro Taller de Investigación y Experimentación Mexicano,https://www.tetiem.org/home.html, contactotetiem@gmail.com,Puebla,Puebla,http://sic.gob.mx/ficha.php?table=teatro&table_id=866,"Se inspira en el movimiento de teatro Independiente Latinoamericano y se define como un grupo con fines artísticos y culturales no lucrativos, comprometido a realizar, gestionar y apoyar propuestas que busquen el máximo nivel de calidad artística."
507,507,La Rekámara Teatro Intimo,https://www.facebook.com/rekamarateatrointimo/,larekamara@outlook.com,Puebla,Puebla,http://sic.gob.mx/ficha.php?table=teatro&table_id=863,"Creado para fortalecer los lazos con el espectador y con el medio teatral, que responde también a una apuesta estética y sobre todo a una necesidad de libertad."
508,508,Teatro Universitario,www.complejocultural.buap.mx/,espacios.ccu@correo.buap.mx,Puebla,Puebla,http://sic.gob.mx/ficha.php?table=teatro&table_id=937,Éste está diseñado para que se aplique la última tecnología en mecánica teatral.
509,509,Microteatro,,,Puebla,Puebla,http://sic.gob.mx/ficha.php?table=teatro&table_id=865,"MICROTEATRO es un formato teatral que consiste en la representación de una micro obra de 15 minutos para un máximo de 15 espectadores, representado en un escenario en donde el público se encuentra integrado dentro de una sala de medidas inferiores a los 15 metros cuadrados."
510,510,Centro Cultural Espacio 1900,https://www.facebook.com/espacio1900/,espacio1900@outlook.com,Puebla,Puebla,http://sic.gob.mx/ficha.php?table=teatro&table_id=861,"El Centro Cultural Espacio 1900 es un recinto con más de 30 años de antigüedad, y que actualmente se preocupa por fomentar la cultura y apoyar diferentes obras de teatro en sus diversos escenarios.
El lugar cuenta con cuatro salas:
Sala Teatro Arlequín con 85 butacas
Sala de Nacimiento o Isabelismo con 70 butacas
Sala de Interiores con 40 butacas
Café Teatro Escenario para alrededor de 120 personas"
511,511,El Breve Espacio,https://www.facebook.com/elbreveespaciopuebla,breveespaciopuebla@gmail.com,Puebla,Puebla,http://sic.gob.mx/ficha.php?table=teatro&table_id=935,Céntrico espacio cultural con restaurante y bar en donde se presentan conciertos y pequeñas obras de teatro.
512,512,Teatro Divertirse.com,,divertirse.com@hotmail.com,Puebla,Puebla,http://sic.gob.mx/ficha.php?table=teatro&table_id=858,"Producir y promover Teatro Clásico infantil de calidad para la sana diversión de las familias poblanas.
Con apoyo de la Empresa Cinco Radio que nos facilita el Auditorio Rafael Cañedo Benítez Realizamos talleres de teatro y danza para niños; especialmente en verano en los cuales hemos tenido una asistencia promedio de 70 niños por curso."
513,513,Teatro La Paz,http://www.puebla.travel/es/ver-hacer/espacios-de-ocio/item/teatro-la-paz, pueblashow@gmail.com,Puebla,Puebla,http://sic.gob.mx/ficha.php?table=teatro&table_id=615,"A partir del año 2007, tras haber realizado trabajos de adaptación y remodelación, el teatro es operado por Dream Theater México, empresa con más de ocho años de experiencia en la producción de obras teatrales, espectáculos artísticos y culturales.
La idea fundamental de sus promotores es recuperar los espectáculos nocturnos de primer nivel para jóvenes y adultos de la ciudad de Puebla."
514,514,Teatro de la Ciudad de Puebla,http://imacp.gob.mx/espacios-imacp/item/44-teatro-de-la-ciudad,"mauricio.imacp@gmail.com, teatrodelaciudad05@yahoo.com.mx",Puebla,Puebla,http://sic.gob.mx/ficha.php?table=teatro&table_id=189,"Se construyó entre 1861 y 1868 por iniciativa del empresario poblano Ignacio Guerrero y Manzano y fue inaugurado el 12 de abril de 1868. Durante cuatro décadas este recinto acogió a diversas compañías de teatro y ópera de la época. En 1909 el edificio fue consumido por un incendio y en 1928 comenzó su reconstrucción. La reinauguración del teatro, con el nombre de Teatro Guerrero, se llevó a cabo el 8 de octubre de 1931 con la presentación de la obra La Malquerida, de Jacinto Benavente, y con la actuación de la primera actriz María Tereza Montoya. El teatro fue remodelado en diversas ocasiones hasta que en 1972 se transformó en cine. En 1993 cerró definitivamente y el inmueble pasó a propiedad del Ayuntamiento. Fue restaurado en 1995 cuando el edificio volvió a funcionar como espacio teatral, pero ahora con el nombre de Teatro de la Ciudad; otra restauración se realizó en 2014 y reinaugurado el 11 de septiembre del mismo año. Ofrece obras de teatro, ópera y danza, conciertos musicales, variedades, espectáculos infantiles, festivales, funciones de cine y circo, conferencias e informes de gobierno."
515,515,Foro teatral del Café Marcel,https://www.facebook.com/pg/CafeMarcel.Puebla/about/?ref=page_internal,manuelreigadas@hotmail.com,Puebla,Puebla,http://sic.gob.mx/ficha.php?table=teatro&table_id=194,"El inmueble que lo alberga fue construido como casa-habitación a mediados del siglo XVI. A principios de la década de los setenta del siglo XX fue remodelado y adaptado como Centro Cultural Espacio 1900 por iniciativa del maestro Manuel Reigadas. La inauguración del teatro se llevó a cabo en agosto de 1972, con la puesta en escena de El Retrato del Flautista de Jordy Tixidor, interpretada por Benito Lavalle, Raúl Ibarra, Alicia María y Manuel Reigadas, bajo la dirección de Geurte Darien y escenografía del maestro Reigadas."
516,516,Teatro del Complejo Cultural Universitario,http://www.complejocultural.buap.mx/,guadalupe.selene@correo.buap.mx,Puebla,Puebla,http://sic.gob.mx/ficha.php?table=teatro&table_id=802,"Fue construido con la finalidad de fomentar todas las expresiones artísticas, culturales, tecnológicas y científicas. Entre las múltiples atracciones se encuentran: una galería de arte, un centro de seminarios, salas de cine de arte, auditorio, teatro y una explanada por mencionar algunos."
517,517,Teatro Melpómene,https://es-es.facebook.com/pages/Teatro-Melp%C3%B3mene/110251349001570,teatropoblano@gmail.com,Puebla,Puebla,http://sic.gob.mx/ficha.php?table=teatro&table_id=643,"El inmueble que ocupa el teatro es adaptado, construido en el año 2006 por el arquitecto Felipe de Jesús Briseño Mendoza. El teatro Melpómene se inauguró el 14 de julio de 2007, con la obra La ventana, dirigida por Aída Andrade, con escenografía de Nadín Pallares y los actores Luis Manuel Cabrera, Nacho Armenta, Hazael Herba y Federico Flores-López."
518,518,Teatro Juan Ruiz de Alarcón,,crpuebla@caminoreal.com,Puebla,Puebla,http://sic.gob.mx/ficha.php?table=teatro&table_id=190,"Fue diseñado por el arquitecto Rodolfo Jiménez Brito, e inaugurado el 16 de mayo de 1996. Se localiza al interior del ex convento de La Purísima Concepción, hoy Hotel Camino Real de Puebla. La primera representación fue Equus por Peter Shaffer, director Fernando Soler Palavicini. Realiza obras de teatro, música, asambleas y conferencias."
519,519,Sala Teatro Luis Cabrera de la Casa de la Cultura de Puebla,,casadelacultura_puebla@yahoo.com.mx,Puebla,Puebla,http://sic.gob.mx/ficha.php?table=teatro&table_id=784,"Forma parte de las instalaciones de la Casa de la Cultura de Puebla. Este edificio fue fundado en 1595 para la instrucción en temas como Filosofía y Moral. Cuando Juan de Palafox llegó a Puebla en 1640, integrando este colegio con el de San Pantaleón y San Pedro para conformar juntos el importante Seminario Tridentino. Aquí se instaló la biblioteca que en nuestros días lleva el nombre de Palafox y que hoy es orgullo de la ciudad y de América. A partir de 1974 es sede de la Casa de la Cultura de Puebla donde semana a semana se programan innumerables eventos artísticos que muestran la cultura de la ciudad y del estado."
520,520,Teatro Universitario Ignacio Ibarra Mazari,https://twitter.com/ElIbarraMazari,,Puebla,Puebla,http://sic.gob.mx/ficha.php?table=teatro&table_id=308,"El Teatro Universitario de la BUAP fue creado en 1948 por Ignacio Ibarra Mazari. En 1952 se cerró por falta de recursos, pero el Consejo Universitario al conocer la solicitud de subsidio para el teatro en 1953, crea el Departamento de Arte Dramático, iniciando el 14 de mayo de ese año, la segunda etapa del teatro. Posteriormente, debido al temblor de 1999, se mantiene sin actividad; sin embargo debido a la gestión universitaria reabre sus puertas para que el público se acerque a las diferentes actividades culturales que organiza, las cuales sirven como foro para los estudiantes. El teatro además de ser un lugar de convergencia de las artes para la comunicación entre los seres humanos, es vehículo de expresión integral de la cultura de un pueblo."
521,521,Teatro al Aire Libre José Recek Saade,https://es-es.facebook.com/TeatroPopularJoseRecekSaade,talas12@hotmail.com,Puebla,Puebla,http://sic.gob.mx/ficha.php?table=teatro&table_id=645,"Este teatro al aire libre está situado debajo del antiguo puente de Nochebuena. Fue fundado en 1976 en honor al poeta y actor José Recek Saade, quien tenía fascinación por la tauromaquia, por lo que la construcción del teatro evoca a una plaza de toros. El espacio permaneció abandonado por varios años y en 2003 fue rehabilitado.
Es un foro abierto para jóvenes creadores que buscan un lugar donde mostrar su arte. Se encuentra abierto a todas las disciplinas artísticas; en él se realizan actividades semanales diversas de caracter gratuito."
522,522,Foro Cultural Karuzo,,barkaruzo@gmail.com,Puebla,Puebla,http://sic.gob.mx/ficha.php?table=teatro&table_id=959,"Espacio cultural fundado en 2007 por el Colectivo de Karuzo, integrado por hombres y mujeres, con perspectiva de género, feminista y de inclusión. En el foro se ofrecen puestas en escena, conversatorios, ciclos de cine feminista, exposiciones de colectivas y artistas feministas. Cuenta con restaurant bar."
523,523,Teatro Principal,http://www.teatroprincipal.mx/,arielazuaracampos@yahoo.com.mx,Puebla,Puebla,http://sic.gob.mx/ficha.php?table=teatro&table_id=188,"El teatro profano se empezó a desarrollar en modestos locales cerrados a los que llamaban ""corral de comedias"" y más tarde ""coliseo"" cuando pasaron a ser administrados por las autoridades de la ciudad, los que eran un retrato en miniatura del orden social jerarquizado en localidades estancas, pues al público se les acomodaba por sexo y pertenencia social. El recinto al que se dio en llamar ""coliseo"" consistía mas bien en un local techado por una cubierta de tejamanil, de tijera y plomo, designada también como jacal. En el patio y en el área del mosquete se agregaban varias bancas, todo lo cual permitía tener una audiencia de más de mil espectadores, como fue el caso del coliseo del Puebla, conocido como el ""Teatro Principal"", el más antiguo de América Latina. Este teatro fue en realidad el sexto coliseo que se estableció en la ciudad, construido por el Ayuntamiento el año de 1759, en un terreno de su propiedad, ubicado en una parte de la extensa Plazuela de San Francisco, para lo que hubo necesidad de demoler la portada que daba acceso a la Alameda. Al año siguiente tuvo lugar la inauguración. La singularidad del recinto se debe no solo a la celeridad de su alzado y al carácter singular de la empresa, sino al hecho de todo insólito de seguir en funciones hasta nuestros días, con el pequeño paréntesis provocado por el incendio de 1902 El plafón original fue pintado por el famoso pintor Miguel Jerónimo de Zendejas, quien plasmo en él las figuras mitológicas de Apolo y Talía, el escudo que Carlos V otorgó a la ciudad de Puebla, y arriba de esa pintura con caracteres transparentes y de tamaño suficiente para ser leídos desde lejos una inscripción latina que traducida al español decía: ""El arte bueno ennoblece a los pueblos""."
524,524,Teatro Arlequín,https://twitter.com/Cia_Arlequin,manuelreigadas@hotmail.com,Puebla,Puebla,http://sic.gob.mx/ficha.php?table=teatro&table_id=191,"El inmueble que lo alberga fue construido como casa-habitación a mediados del siglo XVI. A principios de la década de los setenta, fue remodelado y adaptado como Centro Cultural; espacio 1900 por iniciativa del maestro Manuel Reigadas. La inauguración del teatro se llevó a cabo el 15 de agosto de 1975, con la puesta en escena de Guilherme Figueiredo, La zorra y las uvas, interpretada por los actores Benito Lavalle y Ángeles Peniche, bajo la dirección del maestro Reigadas."
525,525,Foro Cultural Las Nahualas,,foroculturallasnahualas@gmail.com,Puebla,Puebla,http://sic.gob.mx/ficha.php?table=teatro&table_id=864,"Las Nahualas ofrece temporadas cortas de obras originales de pertinencia e impacto social. Buscan la equidad de género e innovación social.
No permiten el racismo y violencia de género en las puestas en escena que ofrecen en cartelera."
526,526,Círculo Escénico,http://www.facebook.com/proyecto35milimetros/,circuloescenicopuebla@gmail.com; mccoy1416@gmail.com,Puebla,San Andrés Cholula,http://sic.gob.mx/ficha.php?table=teatro&table_id=986,"El inmueble fue adaptado para albergar al Círculo Escénico.

Año de construcción del inmueble: 4 de agosto del 2005.

Usos que ha tenido el inmueble desde su construcción:
Antes del 2018 era una bodega de archivo para el Municipio de San Andrés Cholula, posteriormente se comenzó a crear el espacio artístico en 2018.

Primera representación
Título de la obra: Mujer Moderna.
Director: Antonio Ramirez y Gaspar Zepeda.
Escenógrafo: GaZerProducciones.
Actores:
Mercedes Tecuapetla.
Paty Escobedo.
Carem Galiana.
Gaspar Zepeda.
Antonio Ramirez.
Tipo de espectáculos que se realizan:
Teatro, música, danza, variedades, espectáculos infantiles, festivales, conferencias, performance, talleres, exposiciones, laboratorio, cursos.

Número de espectáculos por año
Hemos tenido espectaculo casi cada fin de semana desde que iniciamos (30 funciones por año).

Eventos realizados (los más recientes):
Título de la obra: Amor –Tajados.
Fecha: 14 de Febrero 2020 (estreno).
Título de la obra: Laberintos.19
Fecha: Diciembre 2019 (estreno).
Título de la obra: Charly Shock.
Fecha: Diciembre 2019 y enero 2020."
527,527,Teatro al aire libre Plaza de la Concordia,,turismoycultura@cholula.gob.mx,Puebla,San Pedro Cholula,http://sic.gob.mx/ficha.php?table=teatro&table_id=867,"El inmueble fue adaptado para albergar al Teatro al airte libre Plaza de la Concordia y es público.

Entrada general.

Tipo de espectáculos que se realizan:
Teatro, ópera, música, danza, variedades, espectáculos infantiles, festivales, cine, conferencias, informes de gobierno.

Número de espectáculos por año:
Aproximadamente 20 eventos.

Eventos realizados: (los más recientes)
Título de la obra: Festival Vaniloquio
Fecha: Del 22 de octubre al 29 de noviembre de 2015

Título de la obra: Entrega de juguetes y rosca de Reyes 170X170 mts.
Fecha: 6 de enero de 2016

Título de la obra: Festival Rodante
Fecha: 22 y 23 de noviembre"
