,Unnamed: 0,Nombre,Página Web,Email,Entidad,Municipio,Enlace SIC,Descripción
203,203,Teatro Julio Prieto,,eric.santos@imss.gob.mx,Ciudad de México,Benito Juárez,http://sic.gob.mx/ficha.php?table=teatro&table_id=204,"El Teatro Xola, que en la década de los setenta tomó el nombre del escenógrafo Julio Prieto, fue uno de los primeros de más de 60 foros que el licenciado Benito Coquet (quien estaba a cargo del IMSS) mandó construir en la mayoría de las capitales de los estados del país, en el ámbito de un ambicioso programa de bienestar social para los trabajadores del instituto. El proyecto fue realizado por el arquitecto Alejandro Prieto y su construcción estuvo a cargo del arquitecto Luis Zedillo Castillo. La importancia de este teatro radica en las innovaciones que se hicieron en su escenario, como la abolición del arco de proscenio y la instalación de un disco giratorio. Se inaugura el 19 de mayo de 1960 con la obra Marco Polo, de Eugene O'Neill, dirigida por el maestro Ignacio Retes, con la participación de los actores José Gálvez, José Elías Moreno, Claudio Brook y Leonor Llausás. Se realizan obras de teatro, música, danza, variedades, espectáculos infantiles, festivales, circo, conferencias y asambleas."
204,204,Foro La Teatrería,http://lateatreria.com,shoshana@lateatreria.com,Ciudad de México,Cuauhtémoc,http://sic.gob.mx/ficha.php?table=teatro&table_id=871,"Fue inaugurado el 25 de febrero de 2015 con la puesta en escena El último teatro del mundo. Es un espacio dedicado a las artes escénicas dando cabida a montajes independientes. Cuenta con cuatro foros, restaurante-bar, la escuela La Teatrería Estudio, así como vitrinas diseñadas para albergar breves actos teatrales, dancísticos o performáticos. Da cabida al Proyecto B Teatro, que se lleva a cabo de lunes a domingo, presentando una obra en la sala B de este recinto."
205,205,Teatro Profr. Ismael Rodríguez Aragón,http://www.sntss.org.mx/inicio,gonzalezgar_1323@hotmail.com,Ciudad de México,Cuauhtémoc,http://sic.gob.mx/ficha.php?table=teatro&table_id=401,1 de diciembre de 1990
206,206,Teatro Benito Juárez,,cst.benitojuarez@gmail.com,Ciudad de México,Cuauhtémoc,http://sic.gob.mx/ficha.php?table=teatro&table_id=427,1 de enero de 1984
207,207,"Un Teatro, Alternativa Escénica",http://www.unteatro.org/,unteatrodifusion@gmail.com,Ciudad de México,Cuauhtémoc,http://sic.gob.mx/ficha.php?table=teatro&table_id=929,"El inmueble fue adaptado para albergar a Foro Un Teatro. Es la sede de la productora cultural Realizando Ideas, fundada en 2006 por la coreógrafa y bailarina Jessica Sandoval; dedicada a producir, promover y difundir las diferentes manifestaciones del arte contemporáneo. El espacio fue inaugurado en abril de 2013. Dentro de sus instalaciones posee una galería para exposiciones y venta de arte contemporáneo, un foro para presentaciones públicas de teatro, danza, música, cine, performance, laboratorios, talleres, conferencias, presentaciones de libro, etc. y un departamento-estudio para residencias artísticas nacionales e internacionales. Cuenta además con tienda y cafetería.

Primera representación:
Director: Edson Martínez.
Escenógrafo: Edson Martínez.
Actores:
Diana Delgado.
Valentina Martínez.
Rafael Mejía.
Héctor Hugo de la Peña."
208,208,Sala Moliere,http://www.ambafrance-mx.org/rubrique.php3?id_rubrique=69,,Ciudad de México,Cuauhtémoc,http://sic.gob.mx/ficha.php?table=teatro&table_id=475,1 de enero de 1949
209,209,Foro La Nabe,https://forolanabe.com/,forolanabe@hotmail.com,Ciudad de México,Cuauhtémoc,http://sic.gob.mx/ficha.php?table=teatro&table_id=987,1 de enero de 2016
210,210,Teatro Venustiano Carranza,,varelaproduccionesteatrales@yahoo.com.mx,Ciudad de México,Cuauhtémoc,http://sic.gob.mx/ficha.php?table=teatro&table_id=507,24 de octubre de 1974
211,211,Teatro del Hotel NH,http://mejorteatro.com/teatro-del-hotel-nh/,,Ciudad de México,Cuauhtémoc,http://sic.gob.mx/ficha.php?table=teatro&table_id=779,Se inauguro el 31 de mayo de 2006 Se encuentra dentro de las instalaciones del Hotel NH. Fue diseñado espacialmente para la obra más exitosa de esta empresa productora: Los monólogos de la vagina.
212,212,Teatro Lotería Nacional,http://www.lotenal.gob.mx,correo@lotenal.gob.mx,Ciudad de México,Cuauhtémoc,http://sic.gob.mx/ficha.php?table=teatro&table_id=463,1 de junio de 1974
213,213,Sala de teatro Así que pasen cinco años,http://www.facebook.com/telemakia.heleannejuancristobalcastillo,heleannebs@hotmail.com,Ciudad de México,Cuauhtémoc,http://sic.gob.mx/ficha.php?table=teatro&table_id=827,"En el afán de retomar las raíces del teatro, esta sala cuenta con recursos técnicos mínimos, pues sus propietarios apuestan todo por el trabajo actoral. Además de impulsar a los talentos jóvenes y de acercar a la gente con el teatro alternativo. La entrada es libre de cooperación voluntaria. Funciones de jueves a domingo"
214,214,Teatro de la Ciudad Esperanza Iris,http://teatros.cultura.cdmx.gob.mx/foro/teatro-de-la-ciudad-esperanza-iris,teatros.direccion@gmail.com,Ciudad de México,Cuauhtémoc,http://sic.gob.mx/ficha.php?table=teatro&table_id=420,"Fue construido sobre los cimientos del antiguo Teatro Xicoténcatl, el cual funcionó de 1912 a 1918. Este teatro, construido con un diseño del ingeniero estadounidense Lamb, fue inaugurado el 27 de abril de 1912 con la ópera Aída, de Giuseppe Verdi. Por defectos en su construcción y por su deficiente aislamiento acústico, fue clausurado y adquirido años después por la actriz Esperanza Iris, quien encargó su demolición para construir un nuevo teatro que bautizó con su nombre y cuyo proyecto estuvo a cargo de los arquitectos Federico Mariscal e Ignacio Capetillo Servín. La inauguración del nuevo espacio teatral se llevó a cabo el 25 de mayo de 1918 con la presencia del presidente de la República Venustiano Carranza y la presentación de la opereta La duquesa del Bal Tabarín, a cargo de la Compañía de Opereta Vienesa. Desde su inauguración fue considerado como el teatro más moderno de México por su equipamiento, funcionalidad, elegancia y acústica, convirtiéndose rápidamente en la sede de las grandes novedades artísticas tanto nacionales como extranjeras. En 1934, al transformarse en sala de cine, circo y arena de lucha libre, empezó la historia de su decadencia hasta que en 1955 fue clausurado. En 1976 el Departamento del Distrito Federal se hizo cargo de él y encargó su restauración al arquitecto español Giner de los Ríos. Al año siguiente fue reinaugurado con el nombre de Teatro de la Ciudad. A lo largo de los años el inmueble ha sido objeto de múltiples restauraciones. La más reciente, en 2001, fue encargada al arquitecto Ricardo Prado y su última reinauguración se llevó a cabo el 9 de abril de 2002 con el espectáculo Viva la zarzuela, dirigido por Plácido Domingo."
215,215,Foro del Tejedor,http://forodeltejedor.com,esteban@pendulo.com; xana@pendulo.com,Ciudad de México,Cuauhtémoc,http://sic.gob.mx/ficha.php?table=teatro&table_id=770,"El Foro del Tejedor es el foro de Cafebrería El Péndulo. Se encuentra en su sucursal de la colonia Roma, con un aforo para 114 personas."
216,216,Foro Nahui Olin,http://www.centroculturalsylviapasquel.com/NAHUI.html,foropasquel@hotmail.com; marisol@centroculturalsylviapasquel.com,Ciudad de México,Cuauhtémoc,http://sic.gob.mx/ficha.php?table=teatro&table_id=812,1 de enero de 2011
217,217,Teatro Sergio Magaña,http://teatros.cultura.cdmx.gob.mx/foro/teatro-sergio-maga%C3%B1a,teatrosergiomagana@df.gob.mx,Ciudad de México,Cuauhtémoc,http://sic.gob.mx/ficha.php?table=teatro&table_id=428,"El inmueble fue construido en 1901 para albergar al Templo de Nuestra Señora de la Salud del Convento de las Siervas de María. Posteriormente fue ocupado como oficinas públicas y centro de enseñanza. En 1981 fue adaptado como auditorio por la Conasupo; a finales de la década de los ochenta fue remodelado e inaugurado como teatro el 2 de julio de 1991. La primera representación fue Santísima del dramaturgo mexicano Sergio Magaña, bajo la dirección de Martha Luna, escenografía de Arturo Nava y los actores Ernesto Laguardia, Alma Muriel, Claudia Guzmán y Óscar Narváez. En él se realizan representaciones de teatro, ópera, música, danza, espectáculos infantiles, conferencias y obras de teatro clásico experimental."
218,218,Sensorama,http://www.sensorama.mx/,delfinsensorama@gmail.com; preventa.sensorama@gmail.com,Ciudad de México,Cuauhtémoc,http://sic.gob.mx/ficha.php?table=teatro&table_id=902,1 de enero de 2013
219,219,Foro Lucerna,,info@teatromilan.com,Ciudad de México,Cuauhtémoc,http://sic.gob.mx/ficha.php?table=teatro&table_id=900,"En el mismo edificio que el Teatro Milán se ubica el Foro Lucerna, espacio escénico versátil para las producciones experimentales, que destaca por la configuración de butacas, audio, video e iluminación."
220,220,Foro Indie Rocks,https://www.facebook.com/foroindierocks/timeline,,Ciudad de México,Cuauhtémoc,http://sic.gob.mx/ficha.php?table=teatro&table_id=837,"Lugar muy amplio para todo tipo de conciertos, con terraza al aire libre y un salón dividido en 2 secciones."
221,221,Foro SALA Club,http://sala.club,contrataciones@sala.club; prensa@sala.club ,Ciudad de México,Cuauhtémoc,http://sic.gob.mx/ficha.php?table=teatro&table_id=759,
222,222,Teatro Aldama,https://www.facebook.com/teatro.eventos,enrique.gomez@gouproducciones.mx,Ciudad de México,Cuauhtémoc,http://sic.gob.mx/ficha.php?table=teatro&table_id=294,Su escenario ha sido testigo de grandes e importantes producciones musicales gracias a la tecnología con la que está equipado.
223,223,Teatro Jorge Negrete,,jorgenegreteteatro@hotmail.com,Ciudad de México,Cuauhtémoc,http://sic.gob.mx/ficha.php?table=teatro&table_id=473,"El espacio fue inaugurado el 5 de diciembre de 1957 por el doctor Manuel Sandoval Vallarta, subsecretario de Educación Pública. El inmueble contaba también con una área destinada al Instituto Cinematográfico Teatral, de Radio y Televisión. Después de treinta años de intensa actividad, el teatro fue severamente dañado por el sismo de septiembre de 1985. Los trabajos de restauración, iniciados en 1986, estuvieron a cargo del arquitecto Longoria Treviño. La primera representación fue Malintzin, Medea americana, de Jesús Sotelo Inclán."
224,224,Espacio Universitario de Cultura Off Spring,,foroffspring@hotmail.com,Ciudad de México,Cuauhtémoc,http://sic.gob.mx/ficha.php?table=teatro&table_id=748,"Se abre a la comunidad artística como una alternativa para presentar espectáculos a costos accesibles; cuenta con dos foros, uno para 300 personas y otro para 145, un espacio multidisciplinario en el que los creadores pueden presentar desde un performance hasta una muestra plástica así como con una librería, cafetería y una terraza literaria."
225,225,Teatro Ferrocarrilero Gudelio Morales,,,Ciudad de México,Cuauhtémoc,http://sic.gob.mx/ficha.php?table=teatro&table_id=288,"Este teatro se encuentra en el edificio del Sindicato de Trabajadores Ferrocarrileros de la República Mexicana, ubicado en el área que, en la década de los sesenta, ocupaba el campamento de los trabajadores del ferrocarril de Buenavista. El edificio fue inaugurado por el entonces presidente de la república mexicana Gustavo Díaz Ordaz, el 24 de enero de 1968. El teatro, cuyo diseño estuvo a cargo del arquitecto Mateos, fue inaugurado en el mes de diciembre del mismo año en ocasión de los XIX Juegos Olímpicos, con la presentación de La linterna mágica, espectáculo de la República Checoslovaca."
226,226,Teatro Lúcido,https://www.facebook.com/terreteatro?fref=ts,,Ciudad de México,Cuauhtémoc,http://sic.gob.mx/ficha.php?table=teatro&table_id=872,Este foro independiente se construyó en una casa antigua a la que añadieron un escenario montado en el patio. Además de obras de teatro aquí se presentan bandas y proyectos de música contemporánea. Se inauguro el el 23 de enero de 2014.
227,227,Multiforo Urbano Bajo Circuito,http://bajocircuito.mx/,infobc@arterial.mx,Ciudad de México,Cuauhtémoc,http://sic.gob.mx/ficha.php?table=teatro&table_id=841,"Bajo Circuito es el primer intento de crear un foro cultural en los bajopuentes de la ciudad de México. Es un espacio abierto a la cultura, un escenario para la música, el teatro y el cine, sin dejar de lado las artes visuales y plásticas. Ofrece programación de cine lunes, martes y miércoles; los jueves, viernes y sábados habrá start ups de teatro y por las mañanas talleres."
228,228,LAB TRECE,,,Ciudad de México,Cuauhtémoc,http://sic.gob.mx/ficha.php?table=teatro&table_id=815,"LAB Trece es uno de los cinco foros que han abierto en el último año en el Centro Histórico y son parte de un movimiento teatral: el teatro en pequeño formato o “de bolsillo”, como lo llama el editor y escenólogo Edgar Ceballos."
229,229,Teatro Sala Chopin,http://www.salachopin.com,servicios@salachopin.com,Ciudad de México,Cuauhtémoc,http://sic.gob.mx/ficha.php?table=teatro&table_id=505,"Fue inaugurada en 1952 como foro teatral, en un predio de la Avenida de los Insurgentes, con la obra Mi marido tiene complejos de Jean Bernard Luc, bajo la dirección de Fernando Wagner. En 1965 fue trasladada a la Avenida Álvaro Obregón para constituirse como sede de conciertos y eventos musicales. En 1992 retoma su actividad teatral con la puesta en escena de Una curiosa dama, de John Patrick, bajo la dirección de Germán Robles."
230,230,Centro Cultural de las Artes Escénicas Teatro María Rojo,https://www.facebook.com/Centro-Cultural-de-las-Artes-Esc%C3%A9nicas-Teatro-Mar%C3%ADa-Rojo-384096345041303/photos,barbaracardonamatias@hotmail.com,Ciudad de México,Cuauhtémoc,http://sic.gob.mx/ficha.php?table=teatro&table_id=883,"Su construcción inició en 1960, y fue proyectada por los arquitectos: Luis Ramos Cuningham y Ricardo de Robina. Tal diseño fue utilizado para los tres teatros ubicados en cada una de las secciones de la Unidad Habitacional de Tlatelolco. Se inauguró el 21 de noviembre de 1964 con el nombre de 5 de mayo; tiempo después el teatro, así como el Centro Social y Deportivo de la segunda sección, quedaron a cargo del Gobierno del DDF, a través de la Delegación Cuauhtémoc. El 24 de marzo del 2011 fue reinaugurado como: Centro Cultural de las Artes Escénicas “María Rojo”, siendo ésta la actriz quien aportó su nombre para el recinto. Cabe señalar que en el año 2013 se creó la Dirección General de Cultura en la Delegación Cuauhtémoc, quien ahora se hace cargo de dicho teatro. Actualmente se cuenta con un aforo de 410 butacas, 4 camerinos, salón de los espejos y lobby, éste último utilizándose para exposiciones artísticas."
231,231,Chilango. Foro La Cantera,http://lacantera.com.mx/contacta,la.cantera.estudio.de.danza@gmail.com,Ciudad de México,Cuauhtémoc,http://sic.gob.mx/ficha.php?table=teatro&table_id=756,"laCantera además de ser un espacio de formación cuenta con laCantera Foro Chilango, un foro alternativo en el corazón de la ciudad de México que tiene como propósito funcionar como una plataforma de exhibición para las propuestas de los artistas emergentes de nuestra ciudad y país al apoyarlos desde la producción, creación, difusión, promoción y presentación de sus productos escénicos con el fin de propulsar redes de trabajo para éste sector."
232,232,Centro Cultural El Foco (antes Foro de la Comedia),http://teatrodelarbol.com,contactoelfoco@gmail.com,Ciudad de México,Cuauhtémoc,http://sic.gob.mx/ficha.php?table=teatro&table_id=269,"Este Foro forma parte de las instalaciones del Centro Cultural El Foco, antes Foro de la Comedia. Fue reinaugurado el 14 de enero de 2008 por la compañía Teatro del Árbol con la presencia de los actores Angelina Peláez y Daniel Giménez Cacho."
233,233,Teatro Arlequín (cerrado temporalmente por remodelación),http://www.teatroarlequin.mx/,info@teatroarlequin.mx,Ciudad de México,Cuauhtémoc,http://sic.gob.mx/ficha.php?table=teatro&table_id=395,17 de noviembre de 1953
234,234,Foro El Círculo Teatral (cerrado por demolición),http://www.elcirculoteatral.org/,elcirculoteatral@hotmail.com,Ciudad de México,Cuauhtémoc,http://sic.gob.mx/ficha.php?table=teatro&table_id=380,"Fundado y dirigido por los actores Alberto Estrella y Víctor Carpinteiro, ofrece un espacio para libre realización de las artes escénicas. Fue inaugurado el 7 de abril de 2004. En este lugar se llevan a cabo obras de teatro, así como exposiciones diversas, presentaciones de obras literarias, conciertos de música y lecturas en escena. Ofrece talleres de teatro. Cuenta con cafetería."
235,235,Teatro Casa de la Paz (cerrado por remodelación),,,Ciudad de México,Cuauhtémoc,http://sic.gob.mx/ficha.php?table=teatro&table_id=421,"El Teatro Casa de la Paz es un lugar dedicado al ocio y al divertimento desde el 28 de agosto de 1924, cuando se inauguró como Cine Condesa. Después de un periodo en el que se abrió y cerró en varias ocasiones —incluso salón de baile—, se estableció como Teatro Ariel, hasta que pasó a ser el estudio fotográfico de Francisco Vives. En 1963, la SRE adquirió el lugar a través del Organismo para la Promoción Internacional de Cultura (OPIC). En su remodelación intervinieron personajes como el arquitecto Manuel Larrosa y el artista plástico Manuel Felguérez. La nueva Casa Internacional de la Paz fue inaugurada el 24 de marzo de 1965, recuerda Sergio López, historiador del lugar.
El teatro fue remodelado y adaptado en 1965, sobre las instalaciones del Teatro Ariel -después de cinco años de abandono- por iniciativa del licenciado Álvarez Acosta, ex director del Instituto de Bellas Artes y embajador de la OPIC (Organismo de Promoción Internacional de Cultura de la Secretaría de Relaciones Exteriores), con el objetivo de lograr un nuevo espacio teatral destinado a la presentación de las obras maestras de la literatura universal al alcance del pueblo y sin costo alguno. El espacio tomó el mismo nombre del Teatro de la Paz de San Luis Potosí, de donde era originario el licenciado Álvarez. En 1981 el inmueble pasó a formar parte del patrimonio de la Universidad Autónoma Metropolitana (UAM), de la que depende actualmente. La primera representación en este espacio fue Lisístrata, de Aristófanes, bajo la dirección de Jebert Darién."
236,236,Centro Cultural de las Artes Escénicas Ernesto Gómez Cruz,https://www.facebook.com/pages/Centro-Cultural-de-las-Artes-Esc%C3%A9nicas-Ernesto-G%C3%B3mez-Cruz/293696827331257,centroculturalernestogomezcruz@yahoo.com.mx,Ciudad de México,Cuauhtémoc,http://sic.gob.mx/ficha.php?table=teatro&table_id=438,12 de octubre de 1996
237,237,Foro A Poco No. Teatro Cabaret,http://teatros.cultura.cdmx.gob.mx/foro/foro-poco-no,cst.foroapocono@gmail.com,Ciudad de México,Cuauhtémoc,http://sic.gob.mx/ficha.php?table=teatro&table_id=683,"En cinco años de vida, el Foro A Poco No ha sido un sitio en el que se presenta un mosaico de la producción escénica actual, fortaleciendo el quehacer artístico por medio de múltiples propuestas como el cabaret con su sátira política, el monólogo con sus retos actorales, espectáculos multidisciplinarios acompañados de música de cámara y obras que invitan a reflexionar al público infantil.

Fue bautizado con el nombre de A Poco No por la canción de José Pepe Guízar (1906-1980) la cual fue interpretada por Esperanza Iris, la Reina de la Opereta, en la película Noches de gloria.
Con un cupo de 50 espectadores, el recinto es una apuesta innovadora que alberga expresiones artísticas que constituyen opciones en las artes escénicas, mostrando nuevas formas de admirar y descubrir el teatro. Desde su apertura ha recibido a miles de espectadores y programado a cientos de grupos artísticos. A partir del 2013, el Foro A Poco No permitió potencializar las posibilidades del formato de caja negra. Se apreciaron propuestas teatrales como El hijo de mi padre, monólogo de Adrián Vázquez; Mendoza, de Antonio Zúñiga y Juan Carrillo, y El concierto deseado con la actuación de Stefanie Weiss. Además de que el recinto ha sido sede en diferentes ocasiones sede del Festival Internacional de Cabaret. Durante los últimos meses, el espacio ha sido lugar de innumerables espectáculos para todo público que han logrado un gran éxito y aceptación, entre ellos se encuentran El Grillo, propuesta para niños bajo la dirección de Sandra Rosales, El manual para la carroña de Carreño, propuesta de la compañía Cabaret Misterio y El arco de Iris, montaje para bebés creado y dirigido por Victoria Benet. El Foro A Poco No ha generado un importante impacto entre el público que ha visitado el lugar, principalmente jóvenes, que han hecho del Centro Histórico su sitio de recreación y esparcimiento."
238,238,Foro Claudia,https://forosylviapasquel.com/foro-claudia,foropasquel@hotmail.com; marisol@centroculturalsylviapasquel.com,Ciudad de México,Cuauhtémoc,http://sic.gob.mx/ficha.php?table=teatro&table_id=813,"Se le puso ese nombre por la obra de teatro ""Claudia, me quieren volver loca"" que colocó a Sylvia Pasquel como una primera actriz."
239,239,Foro La Pandilla,,foropasquel@hotmail.com; marisol@centroculturalsylviapasquel.com,Ciudad de México,Cuauhtémoc,http://sic.gob.mx/ficha.php?table=teatro&table_id=814,1 de enero de 2011
240,240,Teatro FSTSE,,rocambra@gmail.com,Ciudad de México,Cuauhtémoc,http://sic.gob.mx/ficha.php?table=teatro&table_id=312,Antiguo teatro 29 de diciembre.
241,241,Teatro Auditorio Congreso del Trabajo,,oficialmayor@eninfinitum.com,Ciudad de México,Cuauhtémoc,http://sic.gob.mx/ficha.php?table=teatro&table_id=255,1 de septiembre de 1976
242,242,Teatro Ciudadela,,,Ciudad de México,Cuauhtémoc,http://sic.gob.mx/ficha.php?table=teatro&table_id=452,"Según el cronista de teatro Antonio Magaña Esquivel (1909-1987), el Teatro de la Ciudadela funciona desde 1954. Fue reinaugurado el 16 de julio de 1970, bajo la administración del ISSSTE, con la obra Anda, cásate, idiota, de Alfonso Paso, bajo la dirección de Eduardo Monden. Funcionó regularmente hasta el mes de septiembre de 1985, fecha en la que fue severamente dañado por el sismo. Después de una nueva remodelación, fue reinaugurado el 12 de octubre de 1987 con un ciclo de espectáculos de danza, música y teatro. Luego de permanecer cerrado durante un año, el teatro de la Ciudadela reabre sus puertas el 17 de octubre de 2003 con la obra Muerte con M de Mujer, bajo la dirección de Amalia Mejía Sánchez y la actuación de Laura Luz."
243,243,Anfiteatro Simón Bolívar,http://musica.unam.mx/taquillas/anfiteatro-simon-bolivar/,anfi@servidorunam.com,Ciudad de México,Cuauhtémoc,http://sic.gob.mx/ficha.php?table=teatro&table_id=476,"Este espacio rectangular está organizado en tres naves, rematadas por un proscenio. Las bóvedas, las columnas, los arcos, las puertas, las ventanas, las cornisas y los barandales están trabajados en un estilo neocolonial, que armoniza perfectamente con el Antiguo Colegio de San Ildefonso. Este recinto cultural alberga La creación, el primer mural del ilustre pintor y muralista mexicano Diego Rivera. En 1922, Rivera inició el mural en el Anfiteatro Simón Bolívar, asistido por Carlos Mérida, Jean Charlot, Amado de la Cueva y Xavier Guerrero."
244,244,Teatro Silvia Pinal,,,Ciudad de México,Cuauhtémoc,http://sic.gob.mx/ficha.php?table=teatro&table_id=518,2 de mayo de 1991
245,245,Teatro Fru Fru,,hugocesar_rico@hotmail.com,Ciudad de México,Cuauhtémoc,http://sic.gob.mx/ficha.php?table=teatro&table_id=399,1 de enero de 1899
246,246,Teatro Metropólitan,http://www.ocesa.com.mx/,sbautista@ocesa.com.mx,Ciudad de México,Cuauhtémoc,http://sic.gob.mx/ficha.php?table=teatro&table_id=459,1 de octubre de 1943
247,247,Teatro I,,marcovii2@hotmail.com,Ciudad de México,Cuauhtémoc,http://sic.gob.mx/ficha.php?table=teatro&table_id=832,"El teatro fue construido ex profeso y es propio. En el año de 1994 fue construido e inaugurado el 30 de octubre de 1995, diseñado por el Ing. Heberto Castillo. Se realizan obras de teatro, música, danza, variedades, espectáculos infantiles, festivales, conferencias y asambleas."
248,248,Teatro II,http://www.teatrodos.com/,marcovii2@hotmail.com,Ciudad de México,Cuauhtémoc,http://sic.gob.mx/ficha.php?table=teatro&table_id=356,"El teatro fue construido ex profeso y es propio. En el año de 1994 fue construido e inaugurado el 30 de octubre de 1995, diseñado por el Ing. Heberto Castillo. Se realizan obras de teatro, música, danza, variedades, espectáculos infantiles, festivales, conferencias y asambleas."
249,249,Teatro Virginia Fábregas,http://www.manolofabregas.com/teatro-virginia-f%C3%A1bregas.html,produccfabregas@hotmail.com,Ciudad de México,Cuauhtémoc,http://sic.gob.mx/ficha.php?table=teatro&table_id=394,Horario de servicio de 11 a 19 hrs.
250,250,Teatro México Centro Teatral Manolo Fábregas,http://www.manolofabregas.com.mx,produccfabregas@hotmail.com,Ciudad de México,Cuauhtémoc,http://sic.gob.mx/ficha.php?table=teatro&table_id=388,6 de abril de 1995
251,251,Teatro Fernando Soler,http://www.manolofabregas.com.mx,produccfabregas@hotmail.com,Ciudad de México,Cuauhtémoc,http://sic.gob.mx/ficha.php?table=teatro&table_id=425,Horario de servicio de 11:00 a 19:00 hrs.
252,252,Teatro Renacimiento  ,produccfabregas@hotmail.com,,Ciudad de México,Cuauhtémoc,http://sic.gob.mx/ficha.php?table=teatro&table_id=369,"Este teatro ue construido en una casa del siglo XVI. Cuenta con 289 butacas y en 2012 fue la sede de las últimas funciones de Defendiendo al cavernícola, el monólogo más exitoso del teatro en México, con 3732 funciones."
