,Unnamed: 0,Nombre,Página Web,Email,Entidad,Municipio,Enlace SIC,Descripción
335,335,Teatro al Aire Libre del Zoológico Zoochilpan ,http://zoochilpan.sacom.mx,,Guerrero,Chilpancingo de los Bravo,http://sic.gob.mx/ficha.php?table=teatro&table_id=186,"Abrió sus puertas por vez primera el 1 de enero de 1978., desde entonces forma parte de los principales recintos para promover y difundir el arte del municipio."
336,336,Teatro María Luisa Ocampo,http://www.garuyo.com/teatro/teatro-maria-luisa-ocampo/lugar,,Guerrero,Chilpancingo de los Bravo,http://sic.gob.mx/ficha.php?table=teatro&table_id=228,"Teatro María Luisa Ocampo. Fue construido en el año de 1982, ignagurado con una obra de teatro de María Lusia Ocampo,""Como un Rayo de sol en el mar"", en 1987; y remodelado posteriormente por el gobierno del Estado de Guerrero. En su reinauguración, el 26 de junio de 1996, se presentó el Ballet Nacional de Cuba bajo la dirección de Alicia Alonso. En se llevan a cabo obras de teatro, ópera, música, danza, variedades, espectáculos infantiles, festivales, cine, conferencias, asambleas, informes de gobierno, eventos políticos y clausuras de fin de curso. Recien remodelado"
337,337,Teatro al Aire Libre Chilpancingo de los Bravo (IMSS) ,http://www.garuyo.com/teatro/teatro-al-aire-libre-chilpancingo-de-los-bravo-imss/lugar,martha.garciam@imss.gob.mx,Guerrero,Chilpancingo de los Bravo,http://sic.gob.mx/ficha.php?table=teatro&table_id=115,280
338,338,Foro Escénico De la Mancha,,delamancha.c@gmail.com,Guerrero,Chilpancingo de los Bravo,http://sic.gob.mx/ficha.php?table=teatro&table_id=972,1 de enero de 2018
339,339,Teatro Popular al Aire Libre Alexander Von Humboldt ,,yoldamlas@hotmail.com,Guerrero,Chilpancingo de los Bravo,http://sic.gob.mx/ficha.php?table=teatro&table_id=49,400
340,340,Teatro al Aire Libre del DIF ,http://www.asipensamos.com/negocios/404908/iguala-de-la-independencia--guerrero/centros-de-espectaculos/teatros/teatro-al-aire-libre-del-dif,iguala.dif@hotmail.com,Guerrero,Iguala de la Independencia,http://sic.gob.mx/ficha.php?table=teatro&table_id=116,200
341,341,Teatro IMSS Iguala ,,esther.garcia@imss.gob.mx; uan.ocampo@imss.gob.mx ,Guerrero,Iguala de la Independencia,http://sic.gob.mx/ficha.php?table=teatro&table_id=63,24 de noviembre de 1964
342,342,Teatro al aire libre Monumento a los Héroes,,iguala.presidente@hotmail.com; diazmilanesio@hotmail.com,Guerrero,Iguala de la Independencia,http://sic.gob.mx/ficha.php?table=teatro&table_id=819,"En 2013 el inmueble fue construido exprofeso para albergar al Teatro al aire libre Monumento a los Héroes, el cual se encuentra dentro del Parque a los Héroes de la Independencia. El Arq. José Luis Díaz Milanesio fue quien lo diseñó.

Tipo de espectáculos que se realizan: música, danza, infantiles."
343,343,Teatro al Aire Libre del Museo a la Bandera y Santuario a la Patria,,museobandera@hotmail.com,Guerrero,Iguala de la Independencia,http://sic.gob.mx/ficha.php?table=teatro&table_id=125,24 de febrero de 1999
344,344,Teatro del Pueblo Aída Reguera Martínez,,,Guerrero,Iguala de la Independencia,http://sic.gob.mx/ficha.php?table=teatro&table_id=711,24 de febrero de 2001
345,345,Teatro Cadac ,http://www.asipensamos.com/negocios/404912/taxco-de-alarcon--guerrero/centros-de-espectaculos/teatros/teatro-cadac,,Guerrero,Taxco de Alarcón,http://sic.gob.mx/ficha.php?table=teatro&table_id=180,1 de enero de 1989
346,346,Teatro al Aire Libre ,,maria.guadarramauv@imss.gob.mx,Guerrero,Taxco de Alarcón,http://sic.gob.mx/ficha.php?table=teatro&table_id=113,1 de noviembre de 1964
347,347,Teatro de la Escuela Primaria Federal Juan Ruiz de Alarcón ,,esc.juanruiz_vespertino@hotmail.com,Guerrero,Taxco de Alarcón,http://sic.gob.mx/ficha.php?table=teatro&table_id=68,1 de enero de 1960
348,348,Teatro Manuel Ángel Núñez Soto,https://www.facebook.com/pages/Teatro-Manuel-%C3%81ngel-Nu%C3%B1ez-Soto-Actopan-Hgo/326460727384753?hc_ref=ARQbSfTzbIJKpc9CEdpR7pm1J5gz1C6X9kRuTxF-zKlcg34s6-iJ0usyHJpb4GA4qi0,,Hidalgo,Actopan,http://sic.gob.mx/ficha.php?table=teatro&table_id=930,
349,349,Teatro Hidalgo,,eduycultura18@gmail.com,Hidalgo,Ixmiquilpan,http://sic.gob.mx/ficha.php?table=teatro&table_id=954,"160

Aforo descripción
160 butacas fijas.
300 sillas removibles"
350,350,Foro El Cubo del Instituto de Artes Real del Monte,http://www.uaeh.edu.mx/campus/ida/,lourdespc@hotmail.com; jrandell@uaeh.edu.mx; dramaticouaeh@hotmail.com,Hidalgo,Mineral del Monte,http://sic.gob.mx/ficha.php?table=teatro&table_id=801,
351,351,Teatro Cuauhtémoc,,,Hidalgo,Mixquiahuala de Juárez,http://sic.gob.mx/ficha.php?table=teatro&table_id=118,16 de enero de 1952
352,352,Foro Cultural Neurodrama,http://www.neurodrama.com,neurodrama@neurodrama.com,Hidalgo,Pachuca de Soto,http://sic.gob.mx/ficha.php?table=teatro&table_id=921,
353,353,Teatro Hidalgo Bartolomé de Medina,https://recintos.culturahidalgo.gob.mx/detailv1.php?espacio=1,sergioorandav@yahoo.com.mx,Hidalgo,Pachuca de Soto,http://sic.gob.mx/ficha.php?table=teatro&table_id=110,"Su fachada principal recuerda al desaparecido Teatro Bartolomé de Medina. Dicho recinto demolido en 1943 se encontraba erigido en la confluencia de las calles Leandro Valle y Matamoros (en el centro de Pachuca). El actual Teatro Hidalgo Bartolomé de Medina se inauguró en marzo de 1957, año en que Quintí­n Rueda Villagrán fungí­a como Gobernador del Estado y Adolfo Ruí­z Cortines fue Presidente de México. Para construir el Teatro Hidalgo Bartolomé de Medina se usó piedra de cantera blanca de Tezoantla, material propio de la región entre cuyas caracterí­sticas destaca el tono sobrio que confiere su empleo; para efectos de la edificación de que se habla, sobresale un toque muy particular de distinción. En el cuerpo central de la arquitectura destacan dos niveles cuya estructura está rematada por un amplio frontón, con tres arcadas en la planta baja y tres balcones en la superior. El recinto albergó la representación parlamentaria del Estado de Hidalgo y, a partir de 1987, se convirtió en recinto cultural de usos múltiples para el desarrollo de diferentes actividades: teatro, danza, conferencias, conciertos y exposiciones."
354,354,Teatro La Garza,www.uaeh.edu.mx,carlosbaston@hotmail.com; gris_ja28@hotmail.com,Hidalgo,Pachuca de Soto,http://sic.gob.mx/ficha.php?table=teatro&table_id=5,1 de enero de 1982
355,355,Sala Siqueiros,,,Hidalgo,Pachuca de Soto,http://sic.gob.mx/ficha.php?table=teatro&table_id=933,"Es un foro independiente, promotor y difusor del teatro en Pachuca."
356,356,NeuroForo,https://es-la.facebook.com/NeurodramaTeatro/,neurodrama@neurodrama.com,Hidalgo,Pachuca de Soto,http://sic.gob.mx/ficha.php?table=teatro&table_id=932,Es un espacio cultural para las artes escénicas
357,357,Teatro de la Ciudad San Francisco,,teatrosanfrancisco@hidalgo.gob.mx,Hidalgo,Pachuca de Soto,http://sic.gob.mx/ficha.php?table=teatro&table_id=109,"Forma parte de las instalaciones del Centro Cultural Ex Convento de San Francisco. Fue construido ex profeso por el Arquitecto Alejando Luna y Félida Medina el 15 de marzo de 1993 y remodelado por la constructora ICA. La primera representación fue Orquesta Filarmónica del Bajío con la dirección de Sergio Cárdenas. Se realizan obras de teatro, ópera, música, danza, variedades, espectáculos infantiles, festivales, conferencias, asambleas e informes de gobierno."
358,358,Teatro Cedrus,http://teatrocedrus.com/,contacto@teatrocedrus.com,Hidalgo,Pachuca de Soto,http://sic.gob.mx/ficha.php?table=teatro&table_id=942,"El recinto tiene capacidad para 660 personas, y semanalmente presenta diversos espectáculos como obras de teatro, conciertos, puestas escénicas."
359,359,Teatro Guillermo Romo de Vivar,http://cultura.hidalgo.gob.mx/infraestructura/teatro-guillermo-romo-de-vivar/,sergioarandav@yahoo.com.mx; olaf.hernandez@hidalgo.gob.mx,Hidalgo,Pachuca de Soto,http://sic.gob.mx/ficha.php?table=teatro&table_id=112,"Este teatro, anteriormente llamado Efrén Rebolledo, y ahora denominado Guillermo Romo de Vivar, formaba parte de las instalaciones de la Casa de la Mujer desde que fue inaugurado el 2 de noviembre de 1958, como un medio para ampliar la cultura de todas las clases sociales, con la presentación de funciones teatrales. Cuenta con un cineclub, reabierto recientemente después de trabajos de remodelación y actualización de las cabinas de proyección."
360,360,Teatro del Pueblo de Tlahuelilpan,,,Hidalgo,Tlahuelilpan,http://sic.gob.mx/ficha.php?table=teatro&table_id=943,"Tipo escenario
frontal"
361,361,Teatro al Aire Libre Zapotlán el Grande (IMSS),,fernando.mundo@imss.gob.mx,Jalisco,Zapotlán el Grande,http://sic.gob.mx/ficha.php?table=teatro&table_id=197,"El inmueble fue construido en el año de 1966, utilizado como albergue después del terremoto del año 1985. La primera presentación que se llevó a cabo, en este espacio cultural, fue La vida del hombre de Leonides Andreiev, dirigida por el Profr. Ernesto Neaves Uribe. Se realizan obras de teatro, presentaciones de música, danza, espectáculos infantiles, festivales, conferencias y asambleas"
362,362,Lakeside Little Theatre,,,Jalisco,Chapala,http://sic.gob.mx/ficha.php?table=teatro&table_id=144,Fue construido por John Mc Arthar Bateman y el arquitecto Javier Orendain en 1987. Forma parte de las instalaciones de la escuela Oak Hill.
363,363,Teatro Manuel Romo Martín,,beralyromo@yahoo.com.mx,Jalisco,Encarnación de Díaz,http://sic.gob.mx/ficha.php?table=teatro&table_id=622,1 de febrero de 1994
364,364,Teatro Degollado,http://sc.jalisco.gob.mx/content/teatro-degollado,edith_delreal@yahoo.com.mx,Jalisco,Guadalajara,http://sic.gob.mx/ficha.php?table=teatro&table_id=381,"En 1855 comenzó a gestarse la idea de que Guadalajara debía contar con un teatro digno de los jaliscienses. Siendo gobernador del estado el general Santos Degollado es emitido el decreto para su edificación. Originalmente se aceptó designar al teatro con el nombre de Alarcón, en honor del dramaturgo Juan Ruiz de Alarcón y Mendoza, el autor teatral mexicano más destacado en los tres siglos virreinales. Sin embargo, tras la muerte del general Degollado fue firmado un decreto para cambiar el nombre del edificio. El autor del proyecto, la ejecución de los planos y la dirección de la obra corrió a cargo del arquitecto tapatío Jacobo Gálvez, quien determinó la colocación de la primera piedra en el año 1856.
Diez años después se verifica la apertura oficial con la representación de la ópera de Donizzetti, Lucía de Lamermoor interpretada por la afamada soprano y actriz Ángela Peralta, conocida mundialmente como El ruiseñor mexicano. El edificio corresponde al periódo neoclásico y en la actualidad, tras su última restauración, es de los mejores conservados en Hispanoamérica. Su sala principal, muy semejante a la Scala en Milán, alberga importantes obras de arte, siendo la más relevante el mural que representa el Canto Cuarto de la Divina comedia, obra de la literatura universal escrita por el poeta Dante Alighieri, ejecutado por los pintores jaliscienses Jacobo Gálvez, Gerardo Suárez y Carlos Villaseñor.
A lo largo de su historia, el teatro ha tenido varias reaperturas: el 13 de septiembre de 1866, el 30 de octubre de 1880, el 15 de septiembre de 1910, el 28 de junio de 1941, el 8 de septiembre de 1964 y el 25 de noviembre de 2005.
En su más reciente restauración se aplicaron transformaciones muy relevantes al inmueble, como la colocación de nuevos pisos, butaquería, trabajos de pintura, sustitución de luminarias, cambio de duela en el escenario e instalación de plataforma hidráulica, instalación de nuevo sistema de aire acondicionado y remodelación de área de camerinos, entre otras. En el marco de esos trabajos, también se aplicó restauración a la hoja de oro de 23 3/4 kilates en áreas como arco de proscenio, águila colosal, marcos, columnas, remates y mascarones en proscenios. Sumamente importante también fue la restauración del telón guillotina que representa una escena griega llamada Festival ateniense, obra que data de alrededor de 1880 y cuya pintura fue ejecutada por el artista italiano Carlos Fontana.
En la actualidad, el recinto es sede de la Orquesta Filarmónica de Jalisco y de espectáculos relacionados con el teatro, ópera, danza y festivales artísticos y culturales."
365,365,Teatro Experimental de Jalisco,,,Jalisco,Guadalajara,http://sic.gob.mx/ficha.php?table=teatro&table_id=351,1 de enero de 1960
366,366,Casa Teatro El Caminante,,elcaminante_teatro@hotmail.com,Jalisco,Guadalajara,http://sic.gob.mx/ficha.php?table=teatro&table_id=346,"El inmueble data de principios del siglo XIX y fue construido como casa habitación. Posteriormente fue remodelada y una de las áreas del recinto adaptada para sala de teatro e inaugurada el 15 de febrero de 2001 con un concierto de música en el que participó Luis Manuel La Paloma y el Mariachi Tradicional de la Secretaría de Educación Pública Estatal, un festival de teatro y una exposición fotográfica de Gustavo Ornelas. Realiza obras de teatro, conciertos, festivales y conferencias."
367,367,Teatro Alarife Martín Casillas,http://sc.jalisco.gob.mx/patrimonio/teatros-y-foros/teatro-alarife-martin-casillas,teatroalarife@hotmail.com,Jalisco,Guadalajara,http://sic.gob.mx/ficha.php?table=teatro&table_id=354,"El inmueble es propio, construido ex profeso en los años 1971/1977 y acondicionado como teatro en 1976. Diseñado por el Arquitecto Julio Ornelas, inaugurado en diciembre de 1976 y reinaugurado el 15 de diciembre de 2004. Se realizan espectáculos de teatro, ópera, música, danza, variedades, espectáculos infantiles, festivales y asambleas."
368,368,Foro de Arte y Cultura,http://cultura.jalisco.gob.mx,mario.vargas@jalisco.gob.mx,Jalisco,Guadalajara,http://sic.gob.mx/ficha.php?table=teatro&table_id=357,"El edificio que ocupa el Foro, fue construido entre los años de 1960 y 1970 por el ingeniero Abel Villa González. Fue Centro de Convenciones del Poder Legislativo y posteriormente se instituyó como Foro de Arte y Cultura en la década de los años 70 por iniciativa del gobierno estatal, quien donó el edificio al Departamento de Bellas Artes. Su primera representación estuvo a cargo del Cuarteto de Cámara “I Solisti” bajo la batuta de Omar Gutiérrez Robles. En su auditorio se presentan obras de teatro, música, danza, variedades, espectáculos infantiles, festivales, circo, conferencias, asambleas, informes de gobierno, así como actos académicos y ceremonias."
369,369,Laboratorio de Arte Variedades. <i>LARVA</i>,,lourdes.culturagdl@gmail.com,Jalisco,Guadalajara,http://sic.gob.mx/ficha.php?table=teatro&table_id=681,"Es un edificio Art Decó diseñado y construido en 1938 para funcionar como cine, vocación que tuvo hasta 1996. Permaneció cerrado hasta el año 2000, que el ayuntamiento de Guadalajara lo adquirió para convertirlo en el teatro de la ciudad, aunque la remodelación quedó en pausa y los trabajos fueron mínimos. Fue inaugurado en el año 2006, como Laboratorio de Arte Variedades LARVA, pero sin una vocación concreta debido al estado del edificio, el lugar no contaba la infraestructura adecuada para ofrecer espectáculos de calidad y seguridad a la ciudadanía. El 31 de diciembre de 2008 se abrió el foro en condiciones precarias para albergar espectáculos de rock y deejays. El 10 de septiembre de 2009 se instaló una cafetería, una galería de arte y una biblioteca especializada. En el 2010 arrancó una nueva etapa en la remodelación del foro con una inversión de 9 millones de pesos. El Teatro de la Ciudad–LARVA se reinaugura el 23 de noviembre de 2011 como un foro multidisciplinario, funcionando como una caja negra (todo el foro puede funcionar como escenario).

Actualmente es un laboratorio de arte donde se gestan artistas y promotores culturales en potencia a través de talleres, conferencias, conciertos, clínicas musicales, charlas y exposiciones. Se ha caracterizado en la ciudad por promover en gran medida el arte alternativo en sus diversas manifestaciones: música, performance, plástica cine y experimental."
370,370,Teatro Jaime Torres Bodet,,,Jalisco,Guadalajara,http://sic.gob.mx/ficha.php?table=teatro&table_id=65,"Esta Galería, Centro Cultural y Teatro está ubicada en la zona suroeste del monumento a los Niños Héroes, y ha ido incrementando sus actividades año con año. Inaugurado como Galería Municipal de Arte en 1965-1967, se reinaugura en 1991 en el marco del 449 aniversario de la ciudad. En su principal acceso se encuentra un busto de Don Jaime Torres Bodet."
371,371,Teatro Guadalajara, http://fidteatros.com.mx/new_site/category/teatros/teatro-guadalajara,teatrogdl2016@gmail.com,Jalisco,Guadalajara,http://sic.gob.mx/ficha.php?table=teatro&table_id=352,"Forma parte del Centro de Seguridad Social Guadalajara. Fue diseñado por Vicente Mendiola Quezada. Su primera representación fue Un tigre a las puertas de Jean Giraudoux, escenografía de Julio Prieto Posada y las actualiciones de María Teresa Rivas e Ignacio López Tarzo, la escenografía corrió a cargo de Julio Prieto Posada. Se realizan obras de teatro, música, danza, variedades, espectáculos infantiles, festivales, cine, circo, conferencias, asambleas e informes de gobierno."
372,372,Teatro Diana ,http://www.teatrodiana.com,svalencia@teatrodiana.com,Jalisco,Guadalajara,http://sic.gob.mx/ficha.php?table=teatro&table_id=595,"Fue diseñado por el arquitecto Julio de la Peña e inaugurado el 28 de julio de 1965. El teatro cierra sus puertas en 1995, en junio de 2001 lo adquiere la Universidad de Guadalajara, se llevan a cabo obras de remodelación y en febrero de 2005 se reinaugura con la obra Lord of the Dance, de Michael Flatey. Ha sido sede del Festival Internacional de Cine en Guadalajara. Actualmente se presentan obras de teatro, música, danza, festivales y conferencias."
373,373,Teatro Sala Higinio Ruvalcaba,http://cultura.jalisco.gob.mx,,Jalisco,Guadalajara,http://sic.gob.mx/ficha.php?table=teatro&table_id=353,"El inmueble en donde se ubica la Sala Higinio Ruvalcaba fue construido en 1726 por el arquitecto Juan Bautista de Mora y remodelado por el arquitecto Gonzalo Villa Chávez. Desde su construcción fue utilizado como Convento de la orden de los Carmelitas, Cuartel Militar y como área de servicios generales de oficinas federales. En la Sala Higinio Ruvalcaba se llevan a cabo los Martes musicales con conciertos de cámara, tanto antigua como de vanguardia; asimismo, los miércoles se realizan conciertos del ciclo Nuevos valores de la música. Los miércoles literarios fueron fundados en 1980 por Elías Nandino para el encuentro del público con las diversas manifestaciones de la literatura como presentaciones de libros, lecturas, conferencias y seminarios sobre diversos autores."
374,374,El Embarcadero Foro Escénico,,,Jalisco,Guadalajara,http://sic.gob.mx/ficha.php?table=teatro&table_id=971,Un espacio sin convenciones para ideas no convencionales. El Embarcadero es un Foro cuyas posibilidades las deciden los creativos.
375,375,Foro Periplo,https://www.elperiplo.com/foro,foroperiplo@gmail.com,Jalisco,Guadalajara,http://sic.gob.mx/ficha.php?table=teatro&table_id=949,"El inmueble del teatro fue construido adaptado, remodelado por el Centro Cultural Foro Periplo. El uso que ha tenido desde su construcción; Casa-habitación, comercio, restaurante, cafetería y bodega.
La primera representación fue Varieté de Circo, con la dirección de la Compañía de Circo, actuación de Cías de Circo local y nacional. Se realizan espectáculos de teatro, música, danza, variedades, infantiles, festivales, circo, conferencias y talleres de formación artística.

Obras recientes:
Residencia de la Compagnia Finzi Pasca, 27 de febrero al 1 de marzo de 2020.
Noche de Stand Up - Mónica Escobedo, 12 de marzo de 2020.
Estrategia Contentura, 14 de marzo de 2020."
376,376,Teatro Vivian Blumenthal,https://www.facebook.com/teatrovivianblumenthal.gdl/timeline,teatro.vivianblumenthal@gmail.com,Jalisco,Guadalajara,http://sic.gob.mx/ficha.php?table=teatro&table_id=840,"Espacio de la Universidad de Guadalajara, antes llamado Foro CEPE, este teatro obtiene su nueva denominación en honor a la actriz y dramaturga tapatía del mismo nombre. Es una alternativa escénica, un espacio íntimo, con espectáculos de primer nivel tanto local, como nacional e internacional. Ofrece servicios técnicos de avanzada y muy profesionales."
377,377,Teatro Griego,http://bycenj.itgo.com,,Jalisco,Guadalajara,http://sic.gob.mx/ficha.php?table=teatro&table_id=317,12 de septiembre de 1958
378,378,La Casa Suspendida. Teatro Café ,https://casasuspendida.wordpress.com/,lacasasuspendida@gmail.com,Jalisco,Guadalajara,http://sic.gob.mx/ficha.php?table=teatro&table_id=665,"Espacio alternativo para la creación de propuestas teatrales propias, así como apoyo, albergue, promoción y sede de presentaciones de otras agrupaciones independientes. Ofrece actividad continua de eventos teatrales, musicales y cine. Fundado desde 1997 por la actriz y directora Sara Isabel Quintero."
379,379,Teatro de Atequiza,,irmaegomar_n@hotmail.es,Jalisco,Ixtlahuacán de los Membrillos,http://sic.gob.mx/ficha.php?table=teatro&table_id=619,1 de enero de 1886
380,380,Teatro José Rosas Moreno,,direcciondecultura@outlook.com; cultura_lagos@hotmail.com,Jalisco,Lagos de Moreno,http://sic.gob.mx/ficha.php?table=teatro&table_id=106,"El monumental teatro comenzó su construcción en 1867 con un diseño del ingeniero civil Primitivo Serrano Flores. Inaugurado el 5 de mayo de 1907 y reinaugurado el 6 de agosto del mismo año, don Agustín Rivera lo define como Palacio de las Bellas Letras y de las Bellas Artes. Fue el artista potosino Jesús Herrera Gutiérrez quien realizó con inigualable maestría su decoración, la cual incluyó pinturas del doctor Bernardo Reyna. Su primera representación fue Aída, de Giuseppe Verdi. En él se presentan obras de teatro, ópera, música, variedades, espectáculos infantiles, festivales, eventos dancísticos, conferencias, asambleas, informes de gobierno y actos académicos."
381,381,Teatro al Aire Libre Lagos de Moreno (IMSS),,,Jalisco,Lagos de Moreno,http://sic.gob.mx/ficha.php?table=teatro&table_id=103,1 de julio de 1968
382,382,Teatro Vallarta,http://www.teatrovallarta.com,sluna@teatrovallarta.com,Jalisco,Puerto Vallarta,http://sic.gob.mx/ficha.php?table=teatro&table_id=710,10 de marzo de 2010
383,383,Teatro al aire libre Parque Lázaro Cárdenas,,institutoculturalpv@gmail.com,Jalisco,Puerto Vallarta,http://sic.gob.mx/ficha.php?table=teatro&table_id=823,"El inmueble fue construido exprofeso para albergar al Teatro al aire libre Parque Lázaro Cárdenas.

Tipo de espectáculos que se realizan: teatro, música, danza, variedades, espectáculos infantiles, festivales, cine, informes de gobierno.

Número de espectáculos por año: 115

Butacas: cemento

Eventos realizados:
Título de la obra: Concierto de Acordeones presentada el 15 de octubre de 2014.
Título de la obra: VII congreso de AA presentada el 20 de septiembre de 2014.
Título de la obra: Brigadas por la Vida presentada el 17 de septiembre de 2014."
384,384,Teatro al aire libre Foro Aquiles Serdán,,institutoculturalpv@gmail.com,Jalisco,Puerto Vallarta,http://sic.gob.mx/ficha.php?table=teatro&table_id=104,"El teatro fue construido exprofeso en el año de 1979, diseñado por el escultor Martín Distancia.
Tipo de espectáculos que se realizan: teatro, música, danza, variedades, espectáculos infantiles, festivales, cine, informes de gobierno.

Número de espectácules anuales: 200

Eventos realizados:
Título de la obra: Evento deportivo por Causa Baja California de fecha 4 de octubre 2014.
Título de la obra: Documental Nuestro Amigo Americano de fecha 3 de octubre 2014.
Título de la obra: Las estrellas iluminan Baja California de fecha 5 de Octubre 2014."
385,385,Teatro Tamazula Margarita Moreno,http://www.visitatamazula.com,grupo_empresarial200@hotmail.com,Jalisco,Tamazula de Gordiano,http://sic.gob.mx/ficha.php?table=teatro&table_id=625,1 de enero de 2007
386,386,Teatro Galerías,http://www.teatrogalerias.net,teatrogalerias@hotmail.com,Jalisco,Zapopan,http://sic.gob.mx/ficha.php?table=teatro&table_id=102,"A principios de los años noventa el empresario Arturo Méndez Valencia comenzó el proyecto del teatro al tener la percepción de la carencia de recintos en la ciudad para este tipo de entretenimiento y que contara con los requerimientos técnicos y escénicos que exigía un montaje actual. El 29 de agosto de 1991 se inauguró con la obra batas blancas no ofenden. Se exhiben musicales, conciertos y puestas en escena locales, nacionales e internacionales."
387,387,Foro Sidral Aga,http://www.palcco.com/,consuelo.perez@palcco.com,Jalisco,Zapopan,http://sic.gob.mx/ficha.php?table=teatro&table_id=881,16 de enero de 2016
388,388,Teatro Moncayo,http://www.palcco.com/teatro-moncayo/,info@palcco.com,Jalisco,Zapopan,http://sic.gob.mx/ficha.php?table=teatro&table_id=941,"Este teatro permite dos accesos a espacios exclusivos: uno para que el elenco ensaye y otro para el equipo técnico.
El Teatro Moncayo es de los pocos en la zona metropolitana de Guadalajara que cuenta con herramientas de última generación, cuenta con elevador de sótano a parrilla técnica, telón principal de doble apertura vertical y horizontal, concha acústica en maple de seis centímetros de espesor, salones de ensayo, camerinos, entre otros.
Es uno de los mejores teatros en la zona metropolitana de Guadalajara, diseñado para diferentes tipos de espectáculo y para conferencias magistrales, congresos y convenciones, presentaciones y eventos."
389,389,Foro del Ángel,,forodelangelgdl@gmail.com,Jalisco,Zapopan,http://sic.gob.mx/ficha.php?table=teatro&table_id=684,20 de noviembre de 2009
